,Rating,Reason,Side Effects,Comments,Sex,Age,Duration/Dosage,Date Added,Drug Name
0, 1, Not now,Stopped taking Arava after 2 weeks. I have not been able to control the diarrhea since stopping this drug. Lomotil has only helped a little bit. Wish I had never taken this drug. I've had diarrhea for 3 weeks now My doctor prescribed this because I had swelling on ONE finger joint. It is a very aggressive drug. I would advise not taking it.,,M,76,14  days10mg 1X D,7/5/2016,Arava
1, 4, RA,I'm good with Arava. It's the cost of it lately that has caused me not to take it everyday_ so my soreness could be due to that or just because I have RA.,,F,52,10  years20mg 1X D,5/19/2016,Arava
2, 4, Ra,Didn't notice any side effects,Was bedridden for months when first diagnosed with ra. Plaque nil was useless and methotrexate caused severe nausea. Very happy with arava results but now I've stopped due to concerns with messed up immune system,F,43,10  years20mg daily,4/10/2016,Arava
3, 1, ,diarrhea and stomach pains,I took ARAVA prescribed by my rheumatologist after taking for over 2 months methrotaxate which was awful with bad side effects. Then after starting ARAVA more side effects and I stopped. But it's been over 2 months and I am still getting the runs_ I mean diarrhea and often accompanied by stomach pains.,F,,  1X D,3/31/2016,Arava
4, 1, RA,major hair loss but worse it trashed my liver. Ended up in the hospital with doctor talking about a liver transplant if things didn't get better. Luckily it has started to heal but I have to take another drug to flush this stuff out of my system. I can't afford these bills.,,F,63,1  years20 1X D,3/15/2016,Arava
5, 1, Ra,Just felt strange on this medicine felt like I was gonna pass out 2 mornings in a row felt very tired couldn't sleep I stopped taking it don't want to take this med anymore not worth the side effects.,,F,53,9  days20,3/3/2016,Arava
6, 4, psoriatic arthritis,Initially no side effects though it did take a long time to start working. In September_ I had a flare - right knee and right pointer toe (sausage toe - excruciatingly painful). The toe calmed down after 24 hours but the knee was not helped in any way_ I had to get a steroid shot in it in December. Also in September_ my toes first_ and then the rest of the feet_ started a tingling/burning sensation and some numbness. I couldn't even touch them. By mid-December_ I was done - informed the doc of the foot issue when I got the knee shot. So I'm done taking leflunomide and back to methotrexate (which I quit before because it makes me so tired).,,F,55,7.5  months20mg 1X D,12/23/2015Email,Arava
7, 1, RA,"6 hours after taking the very first 10mg tablet_ I was trembling to the point my teeth were chattering and I was feeling very unwell. Ambulance was called and all vitals were out of wack so off to emergency. Released when stabilizedafter 6 hours in emergency. 5 hours later I was shaking worse_ was uncoordinated and unresponsive to next ambo team. This time I was hospitalized 2 days till everything stabilized.  Extensive tests determined no infection but a side effect stated as ""flue like symptons!""",Cannot beleive they suggest 3 days on 100mg then 10mg after that. Specialist started me on 10mg thank goodness_  else I'd  probably  be  dead now!! I certainly will NOT be taking Arava  anymore!,M,66,1  days10mg 1X D,12/17/2015Email,Arava
8, 3, RA/Lupus,I have been taking Arava going on four months now.  I noticed immediately the change in bowel habits.  I like this however due to how severely constipated I usually am.  I actually feel like I go like a noreal person now.  I'm starting to notice a bit of hairloss.  Not a lot but concerned it could get worse.  Im curious of anyones experience with the hairloss part of it.  No other side effects so far.  I still have joint pain.,,F,43,1  days20,12/9/2015,Arava
9, 3, RA,Nausea?_ tiredness_ anorexia. Too unfortunate Better ra_ less pain_ greater mobility_ less wheezing. Second go round. First time lasted 1 year until severe nausea and hair loss.,Orencia... severe pneumonia_ prednisone... loss of cartilage_ flattening of breasts_ wrinkling of face_ general loss of feminine attributes.0,F,63,4  weeks,11/23/2015Email,Arava
10, 5, RA,Intermittent diarrhea - sometimes mild_ sometimes severe.  The other 2/3 of the time no problems.  No hair loss. Mild appetite suppression. No itching. No rash.  Labs are normal so far.  I have a nasty cold right now that doesn't seem to want to go away - no one else is sick in my house. Not sure if it's a coincidence or from the arava suppressing my immune system.,I have been on Plaquenil_ stopped due to unrelenting itching. Methotrexate oral and SQ_ stopped due to extreme fatigue and nausea. Imuran_ stopped due to allergic reaction sudden onset fever_ nephritis_ elevated LFTs.  Cyclosporine_ stopped due to angioedema_ rash_ itching.  Humira_ no side effects but developed large lymph nodes and was concerned. Prednisone_ I limit taking due to already having osteopenia from use. So far on Arava I'm no longer fatigued.  Joint swelling and stiffness is much improved. Have had two small flares in a two month period but seem to be self limiting. I've been able to more consistently exercise- walk dogs_ walk on treadmill_ ride horse. Able to more reliably do things around house and yard. Generally feeling more energetic and not so run down from being sore all the time. I actually have days when I don't even think about my RA now. It's been a couple years since I could say that.,F,47,2  months20 mg,9/18/2015,Arava
11, 5, Sero neg RA,Some mild diarrhea,I was in so much pain prior. Uric acid and inflammation levels off the scale. Was taking Tramadol 3x day as I had prior kidney cancer and cannot take NSAIDs. I'm feeling so much better. Walking 25 miles a week now when before I could hardly exercise. No hair loss- I'm curious as to how long others experienced this and how severe?,F,48,8  weeks30 mg,9/15/2015Email,Arava
12, 1, RA,Nausea_ chest pain_ considerable hair loss,Arava did help with the RA pain and inflammation but the side effects were not worth it.  Going through the washout now and hoping the hair loss will subside soon.,F,50,5  months20 mg 1X D,8/26/2015,Arava
13, 3, arthritis,I have been on this drug for a week do you get side affects straight away or can it take a few weeks to kick in .. ive heard it can take a good few weeks before you can get any side affects,,F,31,7  days20mg,8/17/2015Email,Arava
14, 2, RA,Horrible sun sensitivity. To the point my skin hurt after mowing and ended up with little red raised itchy spots all over. I never put 2 and 2 together_ but I have also had the diarrhea others have mentioned for the last 2 years. In the last 2 months_ my joint and muscles have not felt as good and I have had absolutely HORRIFIC hair loss. Lose much more and I will have to get a pixie cut and look like I have mange it is so bad. I emailed my doctor today and told him I'm not taking it anymore. Honestly_ I felt better taking just plaquenil and prednisone for years. Disgusted at rheumatologic therapies. Maybe it wasn't such a good idea to post today. Just keeping it real.,,F,44,2  years20 mg 1X D,7/25/2015,Arava
15, 1, Ra,Loss of taste and smell diarehha but didn't start until about 6 weeks after starting medication,,F,63,2  months10 mg,7/13/2015,Arava
16, 5, RA,"When I  mentioned to my rheumatologist about the annoying diarrhea_ she immediately said_ ""Oh!  That's dosage related!  We can fix that!""  She dropped me from 20 mg. to 10 mg. and I have been fine ever since.  NO dreadful side effects at all!  I did have a mild rash for three months that the cause remained undetermined_ but that cleared up on it's own.",Working GREAT!  No issues!,F,61,2  years10mg 1X D,5/29/2015,Arava
17, 1, OSTEOARTHIRITS/PSORIS,WHOLE BODY HAS RED SPOTS AFTER A GASTROINTESTINAL REACTION_MOUTH ULCERS._URINE INFECTION,I AM VERY AFRAID TO TAKE THIS MEDICATION ANYMORE BECAUSE I CANNOT ACCEPT THIS SIDE EFFECTS,M,59,6  days10MG 1X D,5/19/2015,Arava
18, 3, rheumatoid arthritis,It's been years since I've taken this med so I started taking it at night because it use to make me really nauseated. I'm wondering if I should continue taking it at night or in the morning to get its full effec.,,F,38,5  days,3/17/2015Email,Arava
19, 2, psoriatic arthritis,I started with 10 mg per day_ suffered 2 bouts of bronchitis_ asthma was worse.  After 2 mos. Rheumatologist decided to up dose to 20mg per day. PA pain under control and felt great for 21 days. Then acute diarrhea.  I couldn't leave the house.  Urgent care doctor put me on 2 doses of strong antibiotics no relief. I finally made the connection with arava/leflunamide. I have been advised to stop taking it.  That was yesterday.  Diarrhea is still acute.  Hope it ends soon.,I wish I had known more about the side effects. I also experienced brain fog_ nausea and gastrointestinal distress.,F,51,4  months20mg,2/10/2015Email,Arava
20, 1, Arthritis,Took 5 pills First  morning_ then 1 a day for 2 days. Though I was going to have a seizure or something_ felt like I was trembling all over_ couldn't sleep and felt edgy. Called doc_ she did't think it was the med_ but take a break & try again. Next week_ started with one pill_ by end of 3 rd day trembling started again...glad I didn't take the bigger dose. Stopped pills again_ feeling gone after 24 hours.,Really wanted this to work but the way I felt was scary,F,59,20  days 1X D,12/9/2014,Arava
21, 1, RA,Hair loss started right away.  And chest pains and blood pressure was very high.  My rheumatologist never told me about the bad side affects.  Make sure you know how bad you can feel on this medication.  I finally went off of it when I was getting very sharp pains in my chest like I was being stabbed.  My blood pressure was high.  My primary care physician told me to get off of the drug because of the high blood pressure and chest pains.  My rheumatologist said my hair loss would stop when I stopped taking the leflunomide and I should see a dermatologist if my hair loss was still a problem.  He sure is not very knowledgeable about it staying in your system for up to 2 years.  Got  a new rheumatologist.  He said it does stay in your system up to 2 years.  You have to be your own advocate for your health.,,F,59,5  months20mg 1X D,12/1/2014,Arava
22, 4, RA,mild hair loss_ mild diarrhea_ tingling and numbness in toes_ fatigue,Am taking in combination with Plaquenil. Has made a huge difference in my life. Pain under control day to day with only occasional flares. Am finally able to walk normally and use my hands. Occasional trouble sleeping_ however this problem is better on Arava than off it with severe pain. Am grateful this was offered to me.,F,48,5  months20mg 1X D,11/25/2014,Arava
23, 2, RA,,I got off all drugs and apple cider vinegar worked for 3 years. After a flare up nothing worked for long and I had to change my diet; no white rice or bread. I find the best treatment is physical therapy with cold and hot water bathing and some rub on creams with arthritic gloves for the night. It takes time as you have to teach the body not to attack itself when sleeping (the autoimmune).,M,59,30  days20 mg 1X D,11/16/2014EmailHistory,Arava
24, 1, RA,headache_ nausea_ loss of appetite (but not worth death) sweating profusely as in sopping wet on my clothes sheets_ extreme weakness in legs and feet_ chest pain_ vision_ confusion or just blah brain_  worsening of dry eyes_ nose and mouth_ dizziness_ sleepiness and also sleeplessness_ over all feeling of severe side effects started on 4th day of taking the medication.  Took for 3 more days and then just had to stop it.  After 3 days off side effects are going away and first noticable was sweating and headache thank god.,I have been on just about everything and methatrexate started to make me feel sicker then usual after 12 yrs on it.  Very strange that I started to suffer all of the worse side effects after so long.  So then the PA said_ OH LETS try Arava_ wihtout telling me anything about these horrible side effects I now read about.  This is insane to take this medication as I have felt I was dying and I still do not feel well at all.  I am still on Humera but now hesitate to take this weeks dosage.  Anyone is free to contact me about this drug or any other RA information.  Do I have to take that other drug to get 7 days of Arava out of my system???,F,54,7  days10 1X D,10/21/2014Email,Arava
25, 1, spondylitis,severe hair loss_ cysts/cystic acne_ headaches_ high blood pressure_ rash_ itching_ chronic yeast infection,I started on the 10 mg dose and was fine_ increased to 20 mg after a month and my hair was coming out by the hand fulls.  Headaches and cysts in my face followed.  I literally have a small hole in my cheek one was so deep.  I had bug bites on my legs that grew into what looked like eczema and needed a week or two of rx hydrocortisone to heal.  I had a chronic yeast infection-not sure if related_ that took numerous OTC treatments_ diflucan and finally resorted to coconut oil to control it.  I stopped the drug and my hair continues to fall out_ and now I am starting to itch all over and am nauseous with cramping.  I plan to do the wash out-not sure what is worse the side effects_ especially the hair loss_ or the stress from all this. I have lost at least half the hair on my head_ and it is to the point that I am afraid to brush my hair as I blow dry it as it pulls so much out. This is emotionally devastating.,F,43,3  months20 1X D,10/7/2014Email,Arava
26, 1, ra,Got verry ill i got confused memory loss tingling left side went numb frequent urine vomiting severe stomach ache light color stools insomnia and my daughter thought i had a stroke it cause neurological problems stroke symptoms i fell out while at the store this medication almost killed me  i wouldnt wish tht  on anyone the ra meds they have are dangerous i have tried methotrexate  embriel amd now this make sure if ur gonna take tgis medicine do research first they were gonna do surgery cause thwy thought i was suffeeing from gallbladder problems,,F,51,7  days10,9/14/2014,Arava
27, 1, RA,I took this approximately ten hours ago for the first time ever.  I immediately felt nauseous which subsided somewhat after eating.  I then began feeling anxious for some reason and then came the nonstop itching.  I can't seem to stop.  My throat itches_ my neck itches_ my scalp itches_ my torso itches.  I should have been to sleep three hours ago_ and have had no relief from the itching two hours post-benadryl.   I hate this drug. I can't imagine what it is doing to my organs.,I was diagnosed with RA a year ago.  Fortunately_ I worked at my job for 21 years and received STD and LTD until my SSD was approved.  What a ride.  I have tried methotrexate_ Plaquenil_ prednisone_ Humira.  The drugs for this disease have caused me to be so sick at times I thought I would die.  The worst was the methotrexate cough that turned into bronchitis.  I literally laid in bed for five weeks taking monstrous antibiotics which seemed to make me more sick.  I have a bad feeling about this Arava and will be calling my rheumatologist in the morning to report the annoying itching and anxiousness.  This drug isn't for me.,F,49,1  days20mg 1X D,9/11/2014Email,Arava
28, 1, arthritis,lethargy_ severe hair loss that has not abated.,what a nightmare! I stopped the drug a month ago and my hair's still coming out in clumps (even though I've been taking 10mg biotin_ 3mg folic acid_ and using Rogaine every day). I started the cholestyramine wash-out a few days ago. Still losing hair in clumps_ worried about bald spots on otherwise waist length hair. Arava made me lethargic_ the cholestyramine's not slowing the hair loss yet_ but it's making me sick and I'm missing work because of this. Horrifying experience.,F,50,2  months20mg 2X D,9/10/2014Email,Arava
29, 5, For RA,I have thinning hair_ bouts of diarrhea_ and weight loss.,,F,64,2  years10 mg,7/9/2014Email,Arava
30, 4, RA,It worked great for 2 years_ and all of a sudden_ it's quit working. I wake up with terriblebpain and headaches and nausea every day. I'm sorry to have to say this_ but I don't even have the strength to wipe after going to the bathroom. I don't understand why it worked for 2 years and then just quit?,,F,47,2  years20mg,7/9/2014Email,Arava
31, 4, Rheumatoid Arthritis,In the past 14mos. of being on Arava I have experienced severe weight loss_ thinning of hair_ diarrhea_ occasional sores that do not heal quickly and occasional feelings of tiredness_ headaches & body aches.,,F,37,1  years20mg,6/9/2014Email,Arava
32, 3, RA,I've only been on Arava for 6-7 days_ so hard to tell if it will work yet or not. First day_ I took right before bed. Made my asthma active. Since_ I've been taking around 1pm & that hasn't happened again. Side effects now are mainly just worsened aching and sharp pains in my joints_ hands especially. I'm hoping the weight loss side effect will kick in. I could stand to lose about 5-10 lbs!  :),,F,50,7  days20 MG,5/31/2014Email,Arava
33, 2, RA,frequent nausea and diarrhea,So far_ I have not seen the RA get better with leflunomide but it has not gotten worse either. The nausea is really hard to deal with_ however_ and I wonder if it is self-limiting.,F,32,4  weeks10mg 1X D,5/23/2014,Arava
34, 2, rheumatoid arthritis,Feverish feeling_ fatique_ sore eyes_ blurriness_ light sensitivity_  slight itchy rash,,F,61,6  weeks20 mg.,5/20/2014,Arava
35, 5, Rheumatoid arthritis,Doing great. Helped so much!!!,,F,44,8  months10mg,4/16/2014,Arava
36, 2, RA,Minimal hair loss_ fatigue_ muscle weakness_ blurry vision_ persistant cough_ involuntary muscle spasms_ loose stools_ memory loss.,,F,42,1  months20mg,4/14/2014,Arava
37, 5, exhausted all other RA meds eccept,Diarrhea Many Times a day& frequent urination,,F,56,4  years5 mg,4/6/2014Email,Arava
38, 2, RA,I have been feeling nauseous a few hrs after taking the pill and will then throw up. I am always feeling itchy but there is never any rash. I get terrible headaches that can last almost all day. I also have been needing to constantly pee and have stomach cramps and occasionally chest pain.,,F,18,3  weeks20mg,3/16/2014,Arava
39, 3, Osteoarthritis,The worst side effect has been the hair loss.  My Dr. put me on 1 mg of folic acid to help stop the hair loss_ which seemed to help for a short time and then the hair started falling out again. I actually have a spot that has stopped growing. And_ just recently my arthritis symptoms came back.  My Dr. wanted to up my dose_ but I decided to get off of it.  I am now taking 2 mg folic acid and 10 mg Biotin_ I hope this works to get my hair back..,,F,45,4  months10 mg 1X D,3/5/2014Email,Arava
40, 1, Ankylosing Spondylitis,Horrible drug. Very harsh and irritating to my body. Got over the stomach issues that happened first_ but got severe headaches all the time. The pain from inflammation and join pains got worse. I got off the drug after six days because I feared for my life. Felt like I was going to have a stroke. My PCP said that Arava made the inflammation in my sinuses worse and probably made vascular inflammation worse. Got off it asap.,I understand the drug stays in your system for two entire years. One has to take another horrible drug with side effects to 'wash out' the Arava. Never will touch this poison again. It's not worth it.,F,67,6  days30 MG 1X D,3/3/2014Email,Arava
41, 5, RA,Arava has worked wonders in my life and I'm almost symptom free of joint pain_ swelling and fatigue_ BUT I'M LITERALLY ALMOST BALD AND IT DEPRESSES ME!,,F,39,8  years10 MG,2/18/2014Email,Arava
42, 4, Inflammatory Arthritis/Sjogren's,Hair loss!,Arava has significantly helped my arthritis and general well being. The down side is that I've had EXTREME hair loss. I'm trying various remedies_ including high dose Biotin (10mg). I hope it works. I'm seriously considering going off of it. I'm on plaquenil as well and failed methotrexate.,F,44,3.5  months20 MG 1X D,9/21/2013Email,Arava
43, 3, lupus,Big toenails PAIN w/horizontal indentation_ dry itchy skin w/tingles/paleness_ painful loose bowels 1st month everyday_ moderate/severe head hair loss/GRAYING/brittleness_ existing tinnitus Worse_ dry nose/mild bleeding_ existing calf/ankle/foot edema Worse_ existing brain fog Worse,Lessened knee_ hand_ shoulder_ arm joint pain for about 2 weeks_ after 1 month_ then increased somewhat. All over unwell feeling returned. I sometimes don't know if it's worth it.,F,54,6  weeks20 mg 1X D,9/14/2013,Arava
44, 4, Rheumatoid arthritis,I've been itchy and had a little gastrointestinal distress but has been manageable,Starting to see a glimmer of my old self.  Moving more and a bit easier.  Woke up feeling rested for the first time on years.  I'm hopeful that this will be a good fit.  There seems to be light at the end of the tunnel and for a change it's not a train.,F,63,2  months20 mg 1X D,7/29/2013Email,Arava
45, 4, mixed connective tissue diseases,I was excited over the weight loss as I need to lose a lot. However_ after losing 61 lbs. I have now started to gain rapidly (over 5 lbs. in one week). I am so bummed because I do not want to gain it all back.It seems to have lowered my sed rate. I have also lowered my prednisone but since prednisone actually helps me LOSE weight and feel so much better I don't see that as a good thing. Prednisone has always been my friend. I am not sure now about the Arava.,So far my liver functions are normal. Plaquinil did nothing for me. Arava seems to help.,F,62,5  months20mg 1X D,6/29/2013Email,Arava
46, 2, Psoriatic Arthritis,Hair loss_ decreased appetite_ weight loss_ diarrhea_ abdominal pain_ ITCHING(!!!)_ pneumonia.,I started Arava for psoriatic arthritis towards the middle-end of April.  Initially the side effects seemed to be tolerable...weight loss and mild diarrhea.  Recently I came down with a chest infection that turned into pneumonia.  I ended up in the hospital on IV antibiotics for 6 days.  I have since resumed the Arava_ and now I am noticing quite a bit of hair loss.  Most recently_ I have discovered that it is making me very itchy.  I have stopped it and restarted it twice_ due to the pneumonia.  Each time I restart it_ within a few days_ I become very itchy again.  It is literally from head to toe_ but there is no rash that I can see.  I was previously on MTX_ which was helping_ but I was diagnosed with liver disease and am unable to take MTX at this point in time.  However_ given these new side effects_ I may talk to my rheumatologist about switching back to MTX.  I am also unable to take biologics at this point in time_ due to a rare Remicade reaction.,F,31,2  months20 mg 1X D,6/14/2013Email,Arava
47, 3, rheumatoid arthritis,Dizziness in the morning upon waking is my only complaint so far. It only last for 2 hours and goes away. But so far my joints hurt less and I have more energy! I am super excited about the changes so far and I have only been taking it a few days. Hopefully I only get better.,,F,29,2  days10mg,6/8/2013,Arava
48, 5, Mixed Connective Tissue Disease,Texture change in hair_ minimal hair loss.,Arava was a life saver to me! I have more energy and my joint pain and swelling has lessened. I am starting to see glimpses of my old self coming through after 5 years of trying everything from Imuran to Plaquenil.  It took me about a month before I noticed a difference.,F,44,4  months20 MG 1X D,4/18/2013Email,Arava
49, 5, RA,no side effects _ works brilliantly for me.,,F,46,5  years20 mg,4/18/2013,Arava
50, 5, rheumatoid disease,Loosing my hair,,F,31,5  months20,4/12/2013,Arava
51, 3, RA,Hair loss_ fatigue,,F,35,6  months20mg,4/11/2013Email,Arava
52, 1, RA,Loose stools_ bad stomach cramps_ badly blurred vision_ fatigue_ nausea.I ended up in ER over holidays. Thought it was influenza but it was Arava and it was awful. Stopped med for 3 weeks and started again to be sure...it is the Arava.  It works wonders for the RA but I lost three jean sizes in 3 weeks from the side effects...too sick to eat.,,F,48,4  weeks10 mg,2/3/2013,Arava
53, 2, RA,Considerable fatigue_ constant dry mouth/eyes/skin_ tingling in feet/fingers_ some hair loss. Extreme joint pain/swelling/immobility and muscle achiness.,RA Dr. doubled my dose yesterday to 20 mg a day_ because I haven't had any relief from the 10mg daily dose.After reading everyone's experiences here_ I'm a little nervous as to the worsening side effects. Sure hope this helps because I don't want to go on Biologics.,F,53,6  months10 MG 1X D,2/1/2013Email,Arava
54, 5, RA,no side effects at all,,F,46,4  years30 mg,12/18/2012,Arava
55, 1, RA,loose stools_ nausea_ blurred vision_ tingling/numbness in feet/arms/face,I had no side effects with humira and mtx but after my baby was born_ they weren't as effective.  Changed to Actemra and MTX but rheumatologist was still not happy with results so replaced MTX with leflunomide.  Worked wonders for my RA but the side effects negated the positives. Took cholestyramine to flush leflunomide out of my system 2 weeks ago but still recovering.  Going back to MTX pills.,F,34,3  months20 mg 1X D,11/14/2012,Arava
56, 5, Psoriatic Arthritis,It makes me a little sleepy so i take it at night.  No other side effects so far.  This drug has made all the difference for me.,I was taking a combination of MTX and Humira.  The MTX left me in a constant state of nausea. Now on Humira and Arava and I feel like a new person.  Out of all my symptoms the fatigue was the most debilitating. With Arava I have more energy_ almost no stiffness and joint pain is minimal.  I feel normal. :) I hope it continues to work for me.,F,39,4  months10mg 1X D,11/12/2012Email,Arava
