,Rating,Reason,Side Effects,Comments,Sex,Age,Duration/Dosage,Date Added,Drug Name
49, 1, Holiday to South Africa ( Safari),"Dizzy_ fever_ shaking_ halucinations_ flu like symptoms_ extreme tiredness_ stomach ache_ headache_ depression_ crying unexpectedly_ paranoia_ panic attacks_ high blood pressure reading_ blurred vision_ ""foggy"" head_ loss of memory - hideous side effects.","I had taken anti maleria tablets before but not this one. Was given it by GP nurses on the basis that ""once a week dose is more convenient than daily"" - it's not worth the risk!  Take the daily one.  Malerone works just as well but without the psychological side effects.  Not saying there are no side effects with Malerone_ but they are not as bad by a long way.  One month after taking_ I still feel unwell and hope it will eventually remove itself from my body.  The GPs just try to give you Valium or similar to control the panic attacks (which I did not take as I am not keen to increase the chemical imbalance any further) but I am improving gradually. I went from a perfectly sane and controlled individual to a jibbering wreck and in my view_ this drug should be taken off the market. The more people who publish their experiences the better so that others dont have their holiday ruined the way I did!",F,47,2  weeks 1X W,12/15/2010Email,Lariam
50, 1, 6 month trip across Africa,nightmares_ anxiety_ paranoia_,took Larium in 1993_ side effects immediate and I stopped taking it whilst away as couldnt stand it anymore. It has ruined my life_ still continue to deal with cycles of depression and anxiety. Let me stress taking this drug changed me_ I had absolutely no mental illness prior to my trip and was an outgoing personality. Returned to the UK from African trip to a media outburst from people who had reactions to this_ however obviously nothing has changed as its still available.,F,39,2  months 1X D,12/1/2010,Lariam
51, 1, Trip to Africa,Dizziness_ migraines_ hypohydrosis_ weight gain_ lethagy_ pernicious anaemia_ memory confusion_ general symptoms associated with hypothyroidism.t,Took Larium for one week approx 10 years ago and within hours of taking the tablet became ill. Doctor immediately changed anti-malaria tablet and started treatment for symptoms_ 10 years on_ am having to take daily doses of levothyroxine and have been on countless different types of medication to combat mefloquin contra indications. STILL undergoing tests and medical reviews to combat effects of this drug. Has had a devasting and long term effect on my life_ and continues to do so. It really should be banned.,F,45,7  days 1X D,11/16/2010Email,Lariam
52, 1, Holiday to Africa,Dizziness_ headaches_ panic attacks_ problems with concentration & vision_ aches in chest_ arms and cheeks.,This is poison and is still affecting me 3 months after I finished taking the tablets. It should be banned.,M,48,6  weeks250 MG 1X W,10/22/2010,Lariam
53, 1, trip to Guatemala (anti-malarial),hallucinations_ difficulty sleeping_ severe anxiety_ paranoia_ and depression.,I had no idea this drug would affect me this much.  I have a lot of stress in my life right now and the Lariam has amplified my problems to the point that I can't cope with anything.  I don't feel like myself at all.  The anxiety and depression brings\ me to the point of suicidal thoughts_ because I can't find a way out of the darkness. (This is highly uncharacteristic of me and scares me because I don't know how to deal with such foreign feelings.) I had to stop taking the Lariam after the 7th week when it finally made me snap.  I'm now on anti depressants and anti anxiety medication to help hold me over until the Lariam is out of my system.  I hope I can return to normal.  I would highly recommend that people consider alternatives before using this drug.,F,23,2  months250 MG 1X W,9/21/2010,Lariam
54, 1, military deployment to africa,nightmares_ suicidal thoughts_ depression_ isolation_ paranoid thoughts_,i became really_ really withdrawn from my friends. i was hearing voices in my head. thinking of things that were so far from reality it's scary to think of them now. i wanted to die and the army gave me the tools to do it. if it wasn't for the best of friends i wouldn't be writing this now. cheers buddy. now i still suffer from lariam. i have pains in all my limbs_ bad headaches_ muscle spasms_ low libido_ depression. really disturbed sleep patterns- many nights my wife wakes with me sweating profusely and trying to choke her. this is just mental shit_ dont take one tablet. i dont know if i'll ever be the same again.,M,31,6  months 1X W,9/17/2010Email,Lariam
55, 1, Africa -- Victoria Falls,Peripheral Neuropathy -- atypical GBS Burning pain in legs_ trouble urinating_ weak erections + painful ejaculations_ trouble emptying bowels_ muscle atrophy_ loss of balance_ depression_ suicidal ideation etc. etc. etc.,Do not take this medication - EVER!!!,M,29, 250 MG 1X W,9/14/2010EmailHistory,Lariam
56, 1, African Safari,"Still suffering_ since 2002:Severe depression_suicidal ideation_loss of memory_balance_concentration_word retrieval.Confusion_slurred speech_""black outs"".On & on......",Would NEVER recommend Lariam..It has changed my life forever in so many ways_ I don't have enough room to write the ways.,F,70,6  weeks250 1X D,9/11/2010Email,Lariam
57, 1, PLasmodium P.vivax  (Malaria),Shortness of breath after 2 hrs.(Like couldn't take a complete breath)closed throat_mainly on the left side of my throat_ Anxiety_hallucinations_solid loss of appetite_lights appeared flashy.,Well i was diagnosed with p vivax malaria and I live in India(Bombay) I was a much stronger than any of you guys here..the day I took this crap it really damaged my body _I had no option and i didn't know the side effects.I took 4 pills before dinner the day i was diagnosed and soon started to feel that I couldn't take a complete breath I got real panic and then I realized this has caused epigastric distress and stomach has gone all dead and sore coz it kills the good bacteria in the stomach and makes the stomach sore.then again 4 after 6 hrs i took the first dose of 4 pills and then later 2 after 6 hours again..that day my life changed and I got depressed ..its been a year the anxiety has subsided a lot but it has damaged my stomach ..my appetite came back after 2 months ..but taking a complete breath and closed throat is still the same..I know what u ppl might be going thru..i feel it subsides over time..just keep ur self's hydrated...avoid alcohol till the side effects r completely gone..eat lot of vegtables and fruit.. ty to avoid non veg as far as possible.do NOT EAT SPICEY>>> the stomach issues will come up again making u feel nausatic. ALL I recommend is keep ur self busy doing something like playing video games_reading or walking and doing some mild exercise.This shit will fade over time..and the BEST ..Just pray to GOD>.its all in his hands.we were destined to get this and I feel God just wants us to pray to him.Everything will be alright Love and lig,M,24,1  days30 mg 10X D,9/10/2010Email,Lariam
58, 1, long term stay in East Africa,synestesia and tactile hallucinations_ panic attacks_ severe constant anxiety_ nightmares_ depression_ suicidal ideation_ agoraphobia_ fear of dying_ paranoia_ severe insomnia_ inability to eat_ severe fatigue_ headache_ agitation_ loss of body thermoregulation_ weakness_ tremor_ dizziness_ loss of balance_ motion sickness_ confused thoughts_ sound sensitivity_ very low stress tolerance.,After stopping taking Lariam_ it took 2 more months until the side effects slowly disappeared. And even after that_ at certain moments the symptoms reappeared briefly. It was the worst period I have ever experienced. I am happy the side effects were not permanent_ but I will never ever take this drug again_ and I would advise everyone not to take it. And in addition to the side effects and the damage it does to your body; Taking preventive antimalarial causes the malaria to develop drug resistance. Malaria becomes harder to cure!After three months stopping the Lariam_ I got Malaria. I recovered and I'm now on homeopathic pills. Until now very happy with it!,F,24,6  weeks 1X W,9/10/2010Email,Lariam
59, 1, One-week trip to Rio_ Brazil,Mental: panic attacks_ severe constant anxiety_ anxiety loop thinking_ nightmares_ depression_ suicidal ideation_ social anxiety_ agoraphobia_ anhedonia (lack of interest)_ thanatophobia (fear of dying)_ rage_ aggression_ anger_ mood swings_ paranoia?Physical: severe insomnia_ weight loss (~12kg)_ weight gain (~20kg) inability to eat_ severe fatigue_ headache_ severe liver pain/gall bladder pain_ ?toxic feeling?_ agitation_ sweating_ tremor_ postural orthostatic tachycardia_ faintness_ dry eyes_ malaise_ weakness_ tremor_ numb limbs?Vestibular Dysfunction: dizziness_ loss of balance_ vertigo_ poor cognition_ motion sickness_ confused thoughts_ jumbled speech_ photo-sensitivity_ sound sensitivity_ ?brain fog?_ low stress tolerance?,"The horrors of Lariam are beyond the comprehension of any friend_ family member or medical professional. Those who truly understand are those that have taken and reacted. My story is much like many others; no history of any psychological problems_ feeling great and enjoying life. After the 4th tablet I ""broke"" in March 2009. Collapsed at work with a BPM of 180PM. Then came the long_ long_ long struggle with trying to regain my sanity_ perspective and life. Severe debilitating anxiety consumed me for almost 6 months. After just 4 weeks off work I went back to work_ everyday the same_ shaking and sweating in the office trying to cope with running my own business_ with my friends and colleagues watching in awe and horror. Had to deal with idiotic psychiatrist who put me on 2x different drugs (Pregabalin + Escitalopram) telling me I had an ""anxiety disorder"". Got myself off these drugs after 6 months and continue to improve with rest_ supplements_ ayurveda and *time*. Still suffer with thyroid issues (shaking_ agitation_ tremor)_ vestibular issues (brain fog) and fatigue_ but I am continuing to improve. Lariam completely changed my personality and I have fought to change it back. This drug is Satan's accomplice. It is the worst form of torture and it is a suffering that one shoulders completely alone. I am in the process of setting up a website at lariam.org to help others identify Lariam toxicity and recover from it. I am determined to make a full recovery_ a",M,25,4  weeks250MG 1X W,7/28/2010Email,Lariam
