,Rating,Reason,Side Effects,Comments,Sex,Age,Duration/Dosage,Date Added,Drug Name
0, 5, Trip to Africa,Erotic dreams the night of taking tablet,Lots of men seemed to have nightmares but most women had very good dreams - based on personal survey of fellow backpackers over the months.   The men often stopped taking it.,F,25,8  months,4/1/2016,Lariam
1, 1, Military deployment Kyrgystan,Panic attacks_ severe insomnia_ hallucinations_ ground and objects moving_ tunnel vision_ terrible paranoia.,Was sent home early from the deployment_  I have taken many different medications and  immunizations while in the military such as yellow fever_ anthrax_ smallpox_ typhoid they all had some minor side effect for me.  Nothing has come close to the absolute nightmare that I am still trying to live with.   I now take Depakote_ Paxil_ buspirone and prazosin to keep from panic attacks and nightmares and am struggling to keep my career. Do not risk taking this horrible drug_ I do appreciate that drug companies make product but when the FDA says you can have permanent CNS damage_ just take doxy.,M,40,4  weeks250 mg,11/16/2015Email,Lariam
2, 1, Went to indo,Fever_nightmares_nausea_severe anxiety_ sore throat_ body aches.,Worst drug ever. Stay away,M,24,2  weeks250mg per,11/13/2015,Lariam
3, 1, trip to asia,severe anxiety_ panic_ depression_ depersonalisation_ derealization_ delusional ideas_ paranoia_ insomnia,after only 2 tablets taken 2.5 months ago_ i dont feel the same. it triggered something in me like depersonalisation_ derealisation_ i feel like im on drugs or a psychotic prodrome state. i feel so uncomfortable & on the verge of panic all the time. i cant describe it_ i feel like something is horribly wrong. i wish i'd never taken this_ my doctor didnt warn me of the risk! ive had mental health problems before e.g anxiety but NEVER to this extent. ive always been able to comfort myself when im panicking_ but ive lost all self-help skills. i cant trust anyone including myself. my holiday was a disaster_ i could barely leave my room. now im home & crippled by terror. im always trembling. i distrust everything now; i cant even have panadol or valium because im so scared of medication. antidepressants might help me_ but i just CANNOT put any drug in my body again. i wonder if this feeling will ever go away! i feel completely unreal & wrong inside.,F,25,2  weeks250 1X W,8/11/2015,Lariam
4, 1, Trip to Phillipines,Severe hallucinations_ crying_ shakes_ voices in head_ telling people I was suicidal..... had to cut my trip short and return home.... Doctor did not give me any warnings..... DO NOT TAKE THIS DRUG.... it is dangerous and should be not available.,,F,19,3  weeks30mg 1X W,7/22/2015,Lariam
5, 1, trip to Chang mai,No appetite_ feel nausea and terrible headache. From normal becoming to be more paranoid.,Do not take it,F,18,1  weeks,6/14/2015,Lariam
6, 1, Malaria Prevention South East Asia,Dizziness_ fainting_ inability to concentrate_ severe headache_ light sensitivity_ nightmares_ anxiety and panic attacks.  These side effects continue to persist (it's currently been 7 weeks since my last pill) and I only took this medication for 1 month. This medication is horrible.,,F,30,4  weeks250MG 1X W,6/2/2015Email,Lariam
7, 1, Holiday in India,Insomnia_ Vivid Dreams_ Anxiety & Panic_ Loss of Appetite_ Vertigo_ Light Headedness_ Fever & Sweating_ Dry Cough_ Rash_ Skin Peeling,I've never had a reaction to Malarone or any other drug in the past.  I really wish I'd researched this one before taking it.,F,44,2  weeks250 MG 1X W,3/11/2015Email,Lariam
8, 2, Bali_Indonesia trip.,"Heart Palpitations. Most Vivid somewhat Horrifying dreams I've ever experienced. Somewhat like i was dropped in the movie ""Inception."" Increased anxiety. Skin rash on palm of hands that gradually went up arm. Some minor visual distortions on the day of the week id take it.  I was also a raging ""b****."" I did not contract Malaria though =)","My Uneducated doctor prescribed it to me without reading that my chart that says I suffer from anxiety and depression. Later realized it was a side effect when I came back from my trip. I thought was  going crazy until i realized ""its just the drugs man""",M,21,8  weeks250 1X W,2/7/2015,Lariam
9, 1, To prevent Malaria while in CAR,,,F,44,10  months30 mg 1X W,12/22/2014EmailHistory,Lariam
10, 1, Trip to India,Paranoia_ anxiety_ panic attacks_ black outs_ constant fear of death_ racing heart_ chest pains_ migraines_ insomnia_ stabbing pains throughout body_ tremors_ dry mouth at night_ fatigue_ depression_ unable to concentrate_ crying spells_ spots in vision that have never gone away_ blurry vision_ dizziness_ vertigo_ tinnitus. All of which continue even 14 months after discontinuing the use of lariam. NONE OF WHICH I HAD EVER EXPERIENCED BEFORE,Even hitler didn't deserve lariam. It's a travesty that this poison is legal.,F,28,3  weeks250,12/21/2014Email,Lariam
11, 1, Went to India for 2 months in 1990,,,M,47, 30MG 1X D,10/30/2014EmailHistory,Lariam
12, 1, Mission to Dominican Republic,The weeks I took it_ I had vivid hallucinations_ nightmares_ extreme paranoia_ suicidal thoughts_ diarrhea_ headache_ nausea. Its now been two years_ but I still have thoughts of mistrust_ anxiety_ and paranoia. I feel like I can't fit in with people. I get depressed_ have mood-swings_ and sometimes suicidal thoughts. I feel like a burden and I keep thinking if I was different before I had my episode in DR.,DO NOT TAKE IT. It is not worth risking the adverse side effects.,M,20,2  weeks250mg 1X W,10/14/2014Email,Lariam
13, 1, Military Iraq 2003-2004,It started with a strange depression and really HD dreams.  After about 2 months of this I experianced a convulsive episode for 3-4 hours_ vomiting relentlessly.  At the time I suspected something far diffrent was afflicting me.  The war began to take on a sureal quality to say the least.  After I returned a year later_ my command requested a Psycological eval done.  I was a Sergeant Major.  My career ended_ my views on the world around me were not sequencing with reality in my brain housing group.,It has been 10 years.  I still suffer in differing degrees (waves) of symptoms Esophageal malfunction (cant swallow)_ had abnormal EKG_ dizzy/vertigo and nausea_ headaches_ extreme pain in joints_ had tremor_ nightmares_ and a host of Psych issues_ to include PTSD diagnosed by VA.  Making it through a day without psycological incident is very challenging.  My advice DO NOT TAKE IT.,M,50,12  months25MG 1X W,10/8/2014Email,Lariam
14, 1, Short holiday,Extreme anxiety_ loneliness for no reason_ thoughts of death_ thinking heart attack_ panic attacks_ no interest in sex as my balls constantly shrinking etc. not enough room to list alll,,M,36,3  weeks250mg,9/12/2014Email,Lariam
15, 1, Malaria Prevention,Anxiety_ mild hallucinations_ and dizziness (one episode of debilitating vertigo lasting 1 day during my first month taking Larium) while taking Larium 2009-2011. Now in 2014 frequent mild dizziness_ with 4 debilitating vertigo attacks in the past 3 years. I had never suffered from vertigo before I took Larium_ though I cannot say for sure that the two are linked.,If possible_ take a different drug for malaria prevention. Doxy made me feel nauseated and it was a bother to take every day_ but now I wish I had stuck with Doxy instead of starting Larium. However_ both are preferable to malaria!,F,28,27  months 1X W,8/20/2014Email,Lariam
16, 4, Employment in West Africa,No problems other than unpleasant taste when taken.,Have used intermittantly for around 20 years_ but currently 2 years continuous.,M,54,2  years 1X W,5/20/2014,Lariam
17, 1, Anti malaria prophylactic,Worst possible serious adverse reaction_ including in acute stage after 3rd tablet hallucinations_ delirium_ confusion_ acted out on these confused thoughts and nearly got lost in Kthmandu hills while travelling with friends. Had to be hospitalised under 24 hour supervision until my sister came to bring me back to Australia. I thought I was going to die had to be given heavy duty anti psychotics. When I got home I was a 'vegetable' could barely talk_ or move. Everything tasted strange I slept a lot & over months of recovery experienced fatigue_ anxiety_ agoraphobia_ nightmares. drs said I would recover but I did not. Twelve years later I suffer severe fatigue anxiety_ PTSD plus many symptoms too long to recount here!!,LARIAM is a medication which should not be given to anyone unless they are under strict medical super vision in a hospital. Giving this medicine to people who are travelling is absurd given the high rate of adverse effects!!!! Don't take this medicine it has been banned by the Australian Military & other similar organisations. It should not be on the market!!!! Roche should be sued till they are out of business they have ruined my life I cannot work am being cared for by my 78 year old mother I will be a burden on the state soon I hate Roche for what they have done to me!!!,F,54,3  weeks 1X W,4/5/2014Email,Lariam
18, 1, To Prevent Malaria,Horrific hallucinations_ very strange and vivid dreams that seem like your awake_ anxiety_ suicidal thoughts_ depression_ difficulty thinking_ chronic fatigue_ no longer feel love the same. Feel like I'm in an emotional black hole I can never return from and all those close to me saw the change in only 2 weeks. Still the same effects although to a lessor degree today_ without the hallucinations_ even though it was taken over 10 years ago. Seems to be getting worse with age. Absolute poison I would have rather died of Malaria than be left with the memories of what happened to me while hallucinating. I had absolutely no mental issues before taking only two of these pills they should be illegal.,,M,40,2  weeks,2/16/2014,Lariam
19, 1, for a short holiday_,,,F,,3  weeks 1X W,12/23/2013EmailHistory,Lariam
20, 1, Malaria prevention,"2 years in Central African Republic_ 1 year in Indonesia_ 2 years in Guinea-Bissau.  1991-93_ 1995-98. Initially all we had was the ""Mefloquine Dreams"".  I did end up with Malaria in 1992 anyway.  In 2001 diagnosed with drop foot in the left foot.  In 2004 Began having problems with dizziness.  Checked out as far as an MRI with no potential causes found.  Continued dizziness until a year ago when vertigo and intermittent tinnitus were added to the dizziness and tripping over my own foot.  Visits to ENT and Neuro with no cause or cure.  I'm going to try the VA and see what they might find.","Lariam and its generic version in Mefloquine have both been ""Black Boxed"" by the FDA.  If I had known then what I know now_ I NEVER WOULD HAVE TAKEN THE STUFF",M,67,5  years250 1X W,11/28/2013Email,Lariam
21, 1, malaria prevention,depression_ anxiety_  paranoia_ confusion_ loss of balance_ blurred vision_ long- and short time memory loss_ irritability_  chronic fatigue_ suicidal thoughts_ clumsiness_  muscle atrophy_ muscle and joint pains_ dissociation_ depersonalization_ chest pains_ shortness of breath,The symptoms have been there for 11 years now. Devastating effect on quality of life. Would very much  like to know if there is a cure. I recommend NOT to take this drug.,F,,3  days 1X D,8/6/2013Email,Lariam
22, 1, Travel anti malarial,Psychosis anxiety chronic fatigue it has ruined my life it's been 11 years I still haven't recovered its been so bad nearly committed suicide,,F,54,3  weeks,7/17/2013Email,Lariam
23, 1, trip to Dom republic,Hallucinating_ seeing horrible things_ nervousness. Anxiety ..never ever take this.....it was taken for a holiday but almost ruined my holiday ....should be banned. Was given Prozac to counter act the lariam.,,M,26,1  days,7/9/2013,Lariam
24, 1, Military deployment to africa,Severe short term memory loss_ anxiety_ depression_ lack of empathy,,M,29,8  months,5/16/2013,Lariam
25, 1, 2003/4,Suicide ideation_ depression_ anxiety_ insomnia_ aggression_ lack of empathy_ pain in joints_ spinal problems etc etc,POISON that big pharma keep churning out_ directly responsible for the death of hundreds_DO NOT TAKE THS POISON unless you reall have too_ doctors who prescribe this need to be updated properly on its side effects.,M,45,8  months250 1X W,5/14/2013Email,Lariam
26, 1, OIF Deployment 03-04,We were forced to take this drug weekly before_ during_ and affter the deployment. I experience nausea_ chronic headaches_ mood swings_ nightmares among other things. The command would not accept my refusal to take this med. Almost 10 years later I have been diagnosed by VA for Larium toxicity. This drug can cause lifetime debilitating effects. Please do not use!!!!,,F,30,8  months250mg,3/26/2013Email,Lariam
27, 1, Pre-deployment to Afghanistan,I'd only taken 2 doses as prescribed with the last dose 3 days preceeding the incident at a command function where I blacked out meanwhile fighting several people and the police.  I was charged with Assault on a peace officer (3rd degree felony)_ Assault causing bodily injury_ resisting arrest_ and public intoxication (misdemenors).  It's been about 2 years and am still pending trial.  The only prodromal symptom were vivid dreams (like the Matrix) which was told to be common.  Since the incident no other disturbances in behavior but I was accused of not remembering short term things for a few weeks after.  Medically I think I've recovered but it's a legal nightmare now.,DO NOT USE!!!,M,26,2  weeks250mg 1X W,1/22/2013Email,Lariam
28, 1, Visit to Nigeria,Only took 1 dose_ but felt paranoid_ confused and unable to judge time or make decisions for the next two weeks. In my view Larium is very dangerous. Felt I was going insane. Do not ever take it please!,,F,22,1  days1 dose,1/14/2013,Lariam
29, 1, visit to Malawi,1 pill = itchy red blistering rash expanding all over my body for over a month,,F,22,1  days250mg 1X W,11/8/2012,Lariam
30, 1, ,Loss of cognitive function. Short term memory. Clumsiness _ unable to recognise potential dangers. Dropping things constantly. Unable to remember names of well known persons at times. Mental blocks.,,M,40,1  years??,6/11/2012,Lariam
31, 1, visit to zimbabwe,vomiting_ diarrhea my lips and nails went blue_ confused. taken 15 years ago.,i would not want to contract malaria so it is important to take an antimalaria drug_ just don't take Lariam! I thought it was banned but seems like it is still being prescribed.,F,35,3  days 1X D,6/8/2012Email,Lariam
32, 1, Trip to Kenya,I am on it now. I can't sleep. I can't stay warm_ then I am cold. Every mood is exaggerated. I don't become annoyed_ I go straight to a state of blinding fury. I don't get sad_ I become horribly depressed. I was not told not to drive and three days after getting on this stuff_ I got in a race and went over 80 on a winding road and was in horrible accident (no one has seen anyone walk away from one this bad_ not even EMS). I thought my boyfriends mother was going to attack me (delusions)_ and I had a panic attack in the car after the crash. I can't think clearly. It's like thinking through wax paper. Everything is there_ but I can't get it. I don't understand it unless I really concentrate on tasks and concepts I found simple a month ago. When I try to remember parts of the crash_ it is like I am seeing it third person. It is as if I am watching a movie_ not remembering it. I see the scene from an aerial view_ not from the backboard. I am paranoid and when people try to touch me I scream and cringe. Although I suffered no serious head injuries_ I can not remember most of the night of the crash. I blacked out.  It is the most awful thing I have ever experienced.,,F,18,1  weeksUnknown,6/4/2012Email,Lariam
33, 1, malaria,major depression_ anxiety disorder_ sleep problems_ teeth grinding (bruxism)_ chronic  fatigue_ mood swings_ personality changes_  aggression_ suicidal ideation_ brain fog_ diminished capacity_ impulse control problems_ anger control problems_,MY ARMY UNIT at FORT BRAGG NC was ordered to take LARIAM (mefloquine) when we were on alert to try to rescue the US hostages in Iran in Nov. 1979. No one told us we were being used as guinea pigs for an experimental drug without our knowledge or consent. No one ever asked us if we had any side effects after  Within a few days_ paranoia and anxiety started_ and within a few weeks_ I had full-blown cycling between major depression and violent mood swings_ and I have NEVER been the same since.  But because I didn't know what happened to me_ I went 20 years undiagnosed and untreated_ and I have now been on max dose anti-depressants since 2000. Symptoms get worse with age_ and I am no longer able to work.  When I finally knew from research it was Lariam_ in 2008 I applied for VA disability_ but after 4 YEARS the VA & BVA STILL will not give me an answer!!!,M,54,1  daysmegadose 1X D,4/28/2012Email,Lariam
34, 1, Trip to Mozambique,This drug will take you to hell_ and if you're lucky_ back. 2 years on and still suffer panic attacks with weekly psychotherapy sessions. Traumatic experience. You'd rather be dead.,,F,30,4  weeks250mg,3/11/2012,Lariam
35, 1, Peace Corps Service in West Africa,insomnia_ depression_ loss of appetite_ extremely emotional_ drug-induced hepatitis,I was medically evacuated from my country of service after developing (very rapid) liver complications. The doctors did not know what was causing my liver complications_ and they switched me to Malarone early on in the event that the problem was Mefloquine. It_ in fact_ was directly related to the Mefloquine. I knew that I was not myself while taking it_ but after being off of it for about 4 weeks_ I woke up one morning with my personality back. My liver functions tested normally after 3 months of being off of Mefloquine. I am very fortunate in that. Long-term effects are still to be determined.,F,25,2  months250 1X W,2/25/2012Email,Lariam
36, 1, trip to africa,anxiety_depression_hot flushes_twinges in spine_head aches_suicidal thoughts_extremely voilent and death realted dreams_sickness_panic attacks_paranoia,i ignored the warnings my friends had given me regarding the medication.i cant actually think straight right now and feel completely out of control due to these pills.dreadful dreadful experience.comes in waves.hope it will subside.going to the doctors to change medication!,F,31,2  weeks250mg 1X W,2/19/2012Email,Lariam
37, 1, Trip to the Philippines,Paranoia_ anxiety_ insomnia_ loss of appetite_ hot flushes_ nausea and vomiting_ depression_ suicidal thoughts,,F,32,1  days1 Tablet,2/15/2012Email,Lariam
38, 1, Trip to South Africa,Panic attack_ anxiety_ nightmares_ constant mood swings.,This pill is a real danger_ reading here about patient experiences and mine_ I can not believe that doctors don't advise you about all the side effects_ my girlfriend took malarone and was perfectly fine_ me still suffering of nightmares and anxiety....I hope it desappear in a couple of weeks.,M,34,5  weeks250 MG 1X W,2/9/2012Email,Lariam
39, 1, trip to india,Confusion_ depression_ sadness_ scary dreams_ numbness_ fuzzy brain_ suicide,After taking only one pill_ I noticed a reoccurance of depression symptoms_ which I had not seen for over 5 years. This pill made me feel sad for no reason_ emotional_ and numb. I can;t believe my doc didnt ask me if I had any prior depressive episodes. 4 days later I still feel depressed.,F,30,1  weeks 1X W,12/12/2011,Lariam
40, 1, Malaria Prevention on trip to India,Insomnia_ paranoia_ graduating into hallucinations and extreme psychotic episode lasting approx 3 months,I CANT BELIEVE GPs ARE STILL PRESCRIBING THIS DRUG in 2011..After what happened to me over a decade ago on taking a course of this drug (and to many other people by all accounts - ask Paul Merton) I would say that it should be banned. Really scary that they still think it works. I was flown home on an emergency flight after risking my life on a trip with friends to India and Nepal due to a Lariam-induced psychosis_ extremely frightening for my friends and dangerous for me. On the 'come down' back in a psychiatric ward in the UK (yes the effects were that deep_ severe and prolonged..) I felt suicidally depressed for months and could still hear voices and thought that people were imposters out to kill me..all totally crazy stuff_ I have never experienced such symptoms before_ or_ thankfully_ since. What a damaging poison.,F,36,3  months30mg 1X D,12/3/2011Email,Lariam
41, 1, Short term vacation in Zanzibar,Severe insomnia_ panic attacks_ discomfort_ slight paranoia_ severe vomiting after alcohol intake. Still going on 2 months after the last pill_ seems to get worse.,My boyfriend was recommended Lariam by his Austrian doctor. He didn't feel any side effects but 2 months after the last pill_ I still feel horrible_ cannot get sleep_ am subject panic attacks and paranoia. I wish I had never taken this_ it ruins my life at the moment.,F,25,4  weeks 1X W,10/1/2011Email,Lariam
42, 1, malaria Prevention,1994-1995 ....Following day after first dose I felt very I'll and stressed_ not knowing what was wrong with me... I couldn't relax... and this feeling has sort of stayed with me. Virtually continuous use for 10 months. Continued suffering from fatigue_ ANXIETY_ disorientation_ dizzyness_ lack of concentration_ headaches always the day after taking each pill ( I called it my Lariam Headache) _ alternating between hot and cold within minutes_ depression ( treated with seroxat causing more problems and Very Vivid dreams/nightmares) hospitalised in Abidjan for 3 days and all basic tests for illness proved negative.  I have never got back to the feelings of peace and relaxation that I used to take for granted before I took this devastating poison.,On subsequent much shorter visits to Africa_ I used Malarone_ which did not appear to have any significant side effects !!! DO NOT TAKE LARIAM !!!,M,58,10  months 1X W,7/23/2011Email,Lariam
43, 1, prevent malaria on holiday to India,nausea_ stomache ache_ general feeling of ill health,i wouldn't recommend it. Side effects came on very quickly. I've decided to go back to using the two tablets I had before when I went as I feel so ill. I thought it would be good only having one tablet per week as the other type give me stomach problems too but not as bad I've found,F,56,1  days 1X W,3/2/2011,Lariam
44, 1, Malaria,I experienced swelling of feet_ nausea_ deathly frightening nightmares_ suicide_ paranoia_ vomiting_ diarrhea (not sure if this was from water though)_ pain in stomach_ blood was really hot_ losing my mind_ sadness_ crying for no reason_ recollection of past and possibly past life_ one patch of hair loss_ jittery nerves_ numbing and shaking hands and feet_ and difficulty of breathing.  I am happy I understand that these were side effects and not something I contracted out there.  I do not recommend this drug to anybody.,,M,36,7  weeks 1X W,2/21/2011Email,Lariam
45, 1, Malaria prevention,Anxiety attacks,I have stopped taking it but the anxiety continues,F,64,6  weeks250 mg 1X D,2/12/2011,Lariam
46, 1, Nigeria,Insomnia_ twitching_ restless legs_ loss of concentration_ anxiety_ psychosis_ Depression_ suicide attempt,Took this for about one year starting at age 19. Not only did it not work (I contracted malaria while in Nigeria) but I also experienced the listed side effects for several years.,F,35,1  yearsStandard 1X W,2/3/2011Email,Lariam
47, 1, Malaria,Horrible. You wish you were dead instead.,,M,34,3  weeks 2X W,2/1/2011,Lariam
48, 1, prevention of malaria,nausea_ vomiting_ dizziness_ low mood_ heartburn_ light headed,I took 1 tablet last night and the side effects kicked in right away. I'm already on anti depressants and have a history of anxiety and major depression. My doctor did NOT warn me about the risks associated with Lariam at all. You'd think that with my history_ he would be very cautious about prescribing this drug for me. It's clear after reading this page that my doctor along with many others know NOTHING about the risks. All of today I feel like I am having brain shivers.. as if my brain is struggling to keep up with my body and it's just rattling inside my head. I only ever feel this when I suffer withdrawal symptoms from missing a dose of an anti depressant. I did NOT miss any dose so I know it's the Lariam. Since last night I feel as if something is caught in my throat. It hurts to swallow when I eat because it feels as if my throat passage is narrower. I have severe heartburn. Taking a zantac did not ease the discomfort at all. My head just hurts. I feel dizzy. I had to go home half an hour into work this morning because I couldn't cope. I vomited when I got home. Went back to my doctor and he gave me Stemetil to help with the nausea. Even that isn't helping!!!!! I still feel terrible. My head hurts so much and I've been crying all afternoon. I don't know what to do. I've been poisoned. I am so angry that this drug is on the market. How dare they do this to people.,F,22,1  days250mg 1X W,12/15/2010Email,Lariam
