,Rating,Reason,Side Effects,Comments,Sex,Age,Duration/Dosage,Date Added,Drug Name
50, 1, Endoscopy,I had a routine endoscopy done.  I don't know much about anesthesia so I trusted the anesthesiologist to make the right decision.   After being used as a human pin cushion the iv was administered and shortly after the propofol was introduced.  I went right out and came back to almost full consciousnesses in about 20 min.  The next day I awoke with a headache which I normally don't get that has lasted 4 days now.  On top of that I don't feel like my normal self and my brain doesn't seem to be functioning well in terms of memory and conversation. I've also been experiencing minor tinnitus and a feeling that I'm lacking oxygen.  I'm almost positive the propofol is the cause.  I called the endoscopy center to see if this was normal. They said it wasn't and that I may have the flu or something....,Beware of propofol and this potential effect on some people..,M,29,1  days? 1X D,2/14/2013,Diprivan
51, 4, Colonsocopy,"Woke up really ""thick in the head""_ stoned.  Took about 30 minutes to wake up. Felt really groggy the rest of the day. Got bad headache that night and the next day. Had trouble driving and remembering things the next day. Forgot how to shift my manual transmission. Still feel kinda drugged in the head.  My procedure was early yesterday.",Overall it was OK and I'd probably have it again. Better that some of the alternatives from what I can tell.,M,66,1  daysnot sure 1X D,12/1/2012Email,Diprivan
52, 5, Endoscopy and Colonoscopy,No negative side affects.  Drug was administered at about 11:30 am and I awakened within 30-45 minutes.  I walked back to recovery area. (and I remember walking back to recovery area which I was not able to remember after procedure 5 years ago and a different drug)  I was driven back to my home_ but did not sleep until I went to bed that evening at my regular time.A positive thing that I've noticed_ is that immediately after my procedure my brain function seemed to regain its level of decades ago.  I'm 63 and my brain is functioning like I'm 35.  I have no trouble solving complex problems or recalling the smallest of details including names_ which I'm horrible at.  If this is a side effect_ I hope that it remains.  Strange_ but I thought I would mention this.,,M,63,1  times 1X O,9/22/2012Email,Diprivan
53, 5, Remove cancerous growth on my back,"I did not experience any side effects. The anesthesiologist and I talked about past experiences with versad. He put together a ""cocktail"" of fantyal(spelled wrong)_ versed and propofol. I asked him if I would feel the sharp pain in my arm as it was being administered. I asked him about being sleepy the rest of the day and the length of time in recovery. I did not experience any  pain as they slowly started sedating me as I was being wheeled to OR. There was no counting nor did he tell he was going to give me the cocktail. I rolled over on my side and just closed my eyes. The next thing I remember was being wheeled into my room where my wife was. I was awake_ alert and joking with the nurses. I feel tired because of lack of sleep from worrying about the surgery but it was absolutely great. I shouldnt have worried. The fact that we talked about what to expect helped a great deal. The doctors and staff at the St Vincent Hospital Surgery Center were also very warm_ caring and jok",,M,61,  1X D,9/19/2012Email,Diprivan
54, 5, colonoscopy,No side effects at all.   I was very nervous about having this procedure  because I had never been sedated before.  However_ it was no problem at all!  After the anesthesiologist  injected the medication_ I felt dizzy for a second and the next thing I knew my stretcher was being pushed into the recovery room.  I woke up that quickly.  I felt a little tired for about 10 minutes and within a half hour after that I was walking out the door of the surgi-center.  Do not be nervous like I was -  it's not needed.,,F,48,1  daysunknown 1X O,9/14/2012,Diprivan
55, 5, EGD twice and colonoscopy,This was an amazing drug. Peacfully nodded off to sleep and then awakened a bit groggy but ok. The key to success with this and any other medication is to be honest about all medications you are taking including supplements. Also_ make sure you are honest about your weight and health history because they dose based on all of those considerations.,,F,48,3  times,9/8/2012,Diprivan
56, 1, Given small dose for upper endoscop,I was given propofol three days ago for an upper endo. I am no stranger to the upper endo. I have also had a few surgeries including joint reconstruction for sports injuries. I am beyond upset. I just turned 37 on Monday. I am in shape_ eat raw foods_ and work out. My procedure was done around 2pm on Thursday. I slept pretty much until 11 pm that evening. I was told the next day I could go back to work. I am on no other meds except for my thyroid and prilosec.. Friday I drove to work in a fog. I should not have. The lines in the road were glowing. I felt sluggish and had to hold onto walls while walking. I forgot my usernames and passwords at work (which are my name). Coworkers said I appeared to be drunk (I drink ZERO alcohol). I left work and drove home right away_ except I lost my way home. I drive it every day. I had to pull over and plug in my gps. I have no memory of yesterday. Apparently I called people. I do not remember the conversations I had. And I yelled at people. I went i,never again,,37,1  daysunknown 1X D,9/8/2012Email,Diprivan
57, 5, Colonoscopy,I was so scared to be sedated_ and some of the things I read on the Internet terrified me even more- which is why I want to tell anyone that's nervous about propofol for this kind of procedure that everything went brilliantly smoothly.  I have panic disorder and was very frightened about what it might feel like_ but honestly it was just like when you fall asleep at night.  I woke when the procedure was over with no side effects or pain.  Don't let the Internet scare you_ it was a wonderful experience and I highly recommend it.  One thing I want to add is that it's nice to have an anesthesiologist administering it for further peace of mind_ but to anyone like me that's scared_ I hope this puts your mind at ease a bit.,,F,37,1  days,8/23/2012,Diprivan
58, 1, Endoscopy,So much burning! and my arm keeps on getting like a charlie horse.  & knot that hurts very much and my left side temple is throbbing a lot.,The drug does what it's set out to do I just wish that it didn't have to burn so much.,F,37,1  days 1X D,7/19/2012Email,Diprivan
59, 1, colonoscope,"3-4 minutes into colonoscope I had a ""respiratory event""-stopped breathing. They had to insert a tube through my nose into the trachea to help me breathe and get me stabilized. When I woke up in the recovery room I was throwing up and coughing up blood and my nose was bleeding. The doctor told me that he takes full responsibility for what happened_ and will find out why this happened. I still have a terrible cough 5 days later_ have been on antibiotics since the day of the ""event""_ had to go to the ER for the uncontrollable coughing_ and was put on steroids and an inhaler.",I will absolutely avoid this medicine in the future_ and ask more questions of the dr. and the person administrating any anesthesia. The dr. has called at least once a day_ very concerned about what happened. He has sent the remainder of the batch to the manufacturer for testing. I think it should have been sent to an independent laboratory. This has been a terrible experience_ and I am anxious to get answers.,F,47,  1X D,7/13/2012Email,Diprivan
60, 4, bunionectomy_ screw removed,Bunionectomy went well with no problems.  A year later I had surgery again to remove the screw on the same foot. In the recovery room_ I had myoclonus that affected my whole body. My legs and arms were flaring_ my back was arching and my neck twisted back and forth. I remember being aware but had no control of my muscles.  After about an hour_ the surgicenter called 911 and I ended up in the ER.  I was at the ER for a good 3 hours before the myoclonus went away. I have no longterm adverse reaction but will avoid Propofol in the future.,,F,35,1  days1 time,6/23/2012Email,Diprivan
61, 5, Colonoscopy,Only a scratchy sore throat after administration.,"This was my first colonoscopy and this drug was great!  Nurse administered under supervision (I suppose) of anesthesiologist.  No burning.  She did administer a clear liquid first and this might have been Lidocaine.  The cloudy liquid followed that both via syringe into my IV.  I said ""Oh_ I am feeling dizzy"" and I didn't have a chance to say that my ears were ringing because I was out.  Woke up w/o nausea or vomiting_ fresh_ could have driven home.  So_ outside of the sore throat (and haven't found anything on the internet so far as to why that is happening with some people) I would have this drug again for sure.",F,55,  1X D,5/16/2012Email,Diprivan
62, 2, colonoscopy/endoscopy (@ same time),Propofol worked well for the immediate procedure/ It was administered by a nurse anesthesiologist. I had no burning upon administration_ just a roaring sound in my ears. My problems have been afterward. The day after the procedure_ I experienced agitation_ severe (and sudden onset) depression and also paranoia. I did not have a depression or anxiety issue prior to this procedure. (Mechanically_ I also had challenges urinating -- no flow_ and my bowels still aren't back to normal) One week later the paranoia_ agitation_ and anxiety are still here. It has disrupted my life. I had been taking acetycholine precursor supplements prior to procedure and note in the research that propofol acts on that system_ but I cannot understand exactly how or what I can do to revere these effects.,,F,48,1  days 1X D,5/15/2012Email,Diprivan
63, 4, not sure,"I had eye surgery 2 wks apart and propofal was given both times.   I had no injection pain. No burning_ etc.  The first time was wonderful_ slept_ woke up as needed and felt wonderfully rested.  the second time I was in an euphoric state and DID NOT GO OUT. I was awake during the surgery.  FELT NO PAIN_ nothing.  but I was aware of everything...  I felt like I had ""pulled back into my body""  weird feeling..  I saw the laser light as it cut the flap...  omg wonderful beautiful color... I saw the new lens go in... and pop into place.    No anxiety... just amazing to watch....",It was wierd when this drug started to take effect.    I felt like I was drawing backward/downwards into myself...  and it was more what I heard!   IF you have ever been on a jet... THat was the sound.   Like engines starting to rev up to full power... almost a roaring louder and louder...  but coming from inside my head... until boom  I was out.  except for the second time... I still heard and saw everything...but was ok with it.,F,61,1  daysunsure 1X D,4/15/2012Email,Diprivan
64, 3, Colonoscopy,"Excruciating pain on injection. It felt like a corkscrew being driven into my hand and acid being injected into my vein. I could feel the drug BURN its way inch by inch up my vein to my shoulder. When it reached my shoulder I still was consious and my hand and arm felt like they were burning from the inside out. The nurse asked if I was ok. I told her the Propofol HURT and she mentioned something about ""tiny veins"" to the doctor. I felt like I had been tortured. Later I found out there are ways to minimize the pain_ for example mixing the Propfol with Lidocaine. I would suggest asking about this before the procedure. This was the WORST pain I have ever felt. Why bother giving anesthesia if the anesthesia is more painful then the procedure.",Make sure they use it with Lidocaine to minimize injection pain!,F,52,  1X D,2/3/2012Email,Diprivan
65, 1, colonoscopy,"I was supposed to have propofol administered for a colonoscopy by an anesthesiologist.  Just before the procedure I was told that a CRNA would be administering the drug and: ""she was just as qualified"" as an anesthesiologist.  Nope_ she wasn't. A CRNA is a nurse and she totally blew the ""sedation"" which nearly turned into a disaster.  As I struggled to breathe_ the nurse/CRNA kept asking the GI doc what to do since I was obviously becoming apnic.  After aborting the exam_ I spent 2 days in the hospital and was told: ""if you need propofol sedation get an anesthesiologist not a nurse.  AT least I wasnt' charged and got an apology from the CRNA..she told me that ""she's just a nurse_ not an anesthesiologist""...thanks you almost killed me.",,F,55,1  days 1X D,1/18/2012,Diprivan
66, 1, Colonoscopy,I woke up conscious for about 15 minutes_ but unable to move. I base the time on the conversations I overheard. Finally came around. The next day_ I woke up with a sore throat and the lymph glands under my jaws are sore and swollen. They really hurt. This had better not last long!!!,,F,54,1  days,1/13/2012,Diprivan
67, 1, Colonscopy,It burned when administered through my IV now 2 weeks later I still feel foggy and have noticed problems with my cognitive abilities (ie today I said erotic when I meant erratic) funny as that may be I have noticed other issues and frankly is scares me because I don't know how long this will last.,Next time before any procedure I will want to talk with the anestesiologist prior to the procedure to see which drug he/she plans on using. I will avoid all further sedation.,F,42,1  times 1X D,12/19/2011Email,Diprivan
68, 1, anesthesia for colonoscopy,I was depressed and had cognitive impairment for two weeks.,Did not realize until it was too late that I was not getting conscious sedation drug such as Versed.  This anesthesia was totally unnecessary other than to get me up and out of the facility quicker. Now I know to inquire in advance about anesthesia.,F,71,  1X D,12/1/2011Email,Diprivan
69, 4, low back steriod injections,"Laying here at 3 a.m. for the second time now in 2 weeks after having this. I'm wondering if it is causing it_  but can't find anything online to back up my theory.  Other than that_ I loved it. I have never been ""knocked out"" prior to these 2 times.",,M,38,  1X D,10/26/2011Email,Diprivan
70, 3, endoscopic carpal tunnel release,"I had this surgery done for my left hand and yes the med. worked so great that I woke up thinking ""that was fun - let's do it again.""  I have a major depression/anxiety disorder that I already take so much medication for and also in the recovery room I asked everyone that came walking by that I wanted this medicine in pill form instead of benzodiazepams which I have taken for 30 years.Well it has been almost 2 weeks since that surgery and after that ""happy medicine"" I have had more depression than I have had for years.  I think I would prefer to be drugged by the benzodiazepamseven if I have to take three times as much as a normal person would take and be wide awake (and calmed down) than to wake up with the ""happy juice"" and have depression episodes afterwards.",I guess I should really rate this medicine high but I won't because of the euphoria afterwards and then the weeks of unwanted depression episodes.  I have had 3 surgeries before this and of course never did get euphoric or depressed!  (And kind of grouchy too even though I have no pain from the surgery).  This is the first time with this propofol that I have ever had.,F,56, ? 1X D,9/6/2011Email,Diprivan
71, 1, colonoscopy,woke up with a bad cough and a sore throat....they gave me a breathing treatment....I lost my voice for about 2 weeks and I still have a raspy voice 2 months later....I also had an irregular heart beat for a couple of days...Won't take it again....,,F,75,  1X D,6/30/2011Email,Diprivan
72, 2, Colonoscopy,I had a colonoscopy yesterday at a surgicenter. I have had all previous colonoscopies done at hospitals. This is the first time with Propofol. There was slight burning in my arm_ then I was asleep. Less than an hour after the procedure_ on the way home_ the glands under both jaws hurt and swelled slightly. It is now almost 24 hours and they still hurt and now itch. I like Versed better.,I know it was a CRNA but I did tell her I need only half of what my weight indicates. I have never had any problems or side effects with anything else if given in a half dose... I don't know if she gave me a full dose or this medicine is not right for me.,F,48,  1X D,6/29/2011Email,Diprivan
73, 5, EGD,Did not feel any discomfort while it was being injected through IV tubing.  Went to sleep quickly and awoke quickly.   Had a cough immediately afterwards which nurse says happens sometimes.   Once I got home I didn't feel great_ sore throat and raspy voice.  Cough.   Laid down to rest and was freezing and couldn't warm up.   Had a low grade fever.  It took two blankets_ socks_ and heating pad to get warm.   I think this was from the propofol.,Last EGD I had done was with Versed.  No problems experienced.,F,60, unknown 1X D,6/17/2011,Diprivan
74, 5, EGD,I felt very light-headed during injection_ but fell asleep instantaneously afterward. It was like blinking and being awake again; felt like a very restful peaceful rest.,There was no burning sensation that they warned about_ but it did make me feel light-headed and euphoric for about an hour after it wore off.,M,21,1  timesUnknown 1X D,6/2/2011,Diprivan
75, 5, TWICE--surgery and upper endoscopy,"Does exactly what it's supposed to do. Both times I had Propofol_ I literally drifted off into a peaceful ""slumber."" I'd had Versed/Demerol for anesthesia before and had horrible panic when it was administered_ as well as a minute or so where I couldn't quite go under. Both of my experiences with Propofol were awesome and cured my fear of anesthesia.","My first ""twilight sleep"" with Propofol was amazing. I was totally knocked out (for an operation) and I came to in the recovery area feeling really quite great. I was groggy for maybe a minute total. I was able to get up immediately_ sip some juice_ eat some crackers_ get dressed_ and walked out the door with my ride. An hour later_ my husband took me for grilled cheese and fries and I was totally back to normal within a few hours. Today I had my second experience with Propofol_ used for an upper endoscopy with biopsy. I'm glad my doc uses Propofol for this as it makes the experience much easier. I did have a much harder time with recovery today though--was very groggy and emotional for about 45 minutes after being woken up. I wasn't able to leave the recovery area for an hour. My doctor mentioned that this was probably due to my poor health in recent years_ so it makes sense that it was harder on my body this time. Needless to say_ I'll take Propofol over any other anesthesia any day. None of that nausea or horrible need to sleep that comes with Versed. Side note--my Propofol was administered by an excellent anesthesiologist. He used a lidocaine solution to eliminate all of that burning sensation (which is really kind of scary--I had it the first time). He also had me suck down some oxygen while I was counting to 10 and the Propofol went in--I was totally out by 7.",F,25,1  days 1X D,5/25/2011,Diprivan
76, 5, ERCP,Euphoria then complete sedation.  First times used I had no side effects other than groggy for about 30-45 mins.  Last procedure_ I developled allergy like symptoms_ severe including watery_ itchy eyes; itchy irriated nasal passages_ particularly on left side - the side on which I was laying; lots of sneezing and drainage.,"Would definitely use again. Have used during numerous surgeries and procedures. Accomplishes the objective of ""amnesia"" during surgeries and procedures with limited side effects.  I am a mostly healthy person_ don't smoke_ not overweight. Have trusting doctors with whom I communicate clearly and openly.",F,44, Unknown 1X D,5/2/2011Email,Diprivan
77, 1, colonoscopy,yep_ I was given 500mg of propofol (50ml of propofol 1%) for a supposedly simple outpatient colonoscopy.  I couldn't breathe or communicate_  they kept giving me more of this drug despite my begging for them to stop.  It did NOTHING for pain and left me unwilling to every have anesthesia or sedation again.,Don't consent to propofol unless it's given by an anesthesiologist; nurses such as CRNA just don't have the skill set to handle this drug.  My doc told me this after I had a HORRIBLE incomplete colonoscopy with propofol and she blamed the CRNA for everything....,F,55,1  days500mg 1X D,3/29/2011,Diprivan
78, 5, Colonoscopy,The effects of any drug depends on your personal health_ what other drugs you are taking_ the length and type of procedure...just a bunch of stuff.  I had 'sedation' administered by a nurse...not a CRNA (a nurse that past a hospital made-up test).  I screamed_ I remember screaming_ it hurt really bad (found out women have more turns than men...there is a uterus in the way or adhensions after other surgery) and I lost the entire day.  (I found out the gastroenterologist was also working on my rear while directing a nurse not trained in anesthesia to give me Versed_ Fentanyl and Phenergan...it was so bad_ I paid to have my records sent to me.A CRNA gave me Propofol (Diprivan) 5 years later.  I found out that propofol burns when a smaller vein is used and in younger patients.  The CRNA gave me lidocaine before the propofol....it was no more unpleasant than getting my TB skin test.  I woke up_ went out to each lunch_ and even played golf that afternoon.  Moral of the Story:  Know your ga,,F,58,  1X D,2/24/2011,Diprivan
79, 3, Shoulder surgery,When the anethesiologist started the Propofol into my IV_ I immediately felt a horrible sensation in my IV arm. I remember saying outloud 3 times to the staff in the OR-OW!OW!OW! My arm-something is wrong. I felt like the drug was going into my arm and not the vein. Next thing I remember is waking up in recovery. The good thing about this drug is I had no nausea or side effects at all. I went home after being in recovery for around an hour and felt really good. Not sleepy or anything. Actually was smiling and saying the surgery was a piece of cake EXCEPT the anethesia when it was started.,,F,55,  1X D,2/18/2011,Diprivan
80, 1, surgery,couldn't breathe_ admitted to ICU,not a safe drug unless given by an MD.  The nurse CRNA almost killed me with this stuff.  Scary.,F,44,1  days 1X D,2/7/2011,Diprivan
81, 4, Colonoscopy,I was told I would be given this drug for the procedure and they put it in the IV and all I remember was saying... Oh this stuff is... and I was out. But when I woke up I was sneezing and my nose was running_ now its the next day_ and its the same. I cant stop sneezing and my nose is running. I wonder if its the drug. It worked great_ I woke up and was alert in 5 minutes.,Has anyone else had the sneezing and running nose??,F,51,1  timesdont know 1X D,2/2/2011,Diprivan
82, 1, colonoscopy,A couple of hours after this outpatient procedure_ I started with some pain in my throat.  I thought I may have caught something like a cold.  By the next morning_ I had both sides of my neck (lymph nodes) swollen_ and was experiencing a lot of pain_ even to the touch.  I could not swallow very well_ and had also a rash on the sides of my face.  The pain did not go away for several days_ and even a week after the procedure I still had some pain on my right side node under the jaw.,,F,57, unknown 1X O,1/28/2011,Diprivan
83, 4, Anesthesia during GI Endoscopy,"No side effects during induction or recovery. Induction was instantaneous and recovery following initial wake up was complete within 5 minutes. I awoke (became conscious) in the middle of talking to the Anesthetist about her job and how she liked her field. I was also given a dose of Versed to induce amnesia during the procedure (which was apparently very successful_ given that I didn't even remember starting a conversation with the anesthesiologist during recover.) From what I gather I came out of the Propofol first and started talking_ then the Versed wore off and I started ""remembering"" what I was talking about - a strange sensation to be sure_ but not unpleasant or frightening in any way.",While I would not recommend using this drug as a sleep aid_ it is a very efficacious anesthetic and I had NO ill effects from it. I would like to note that I asked the nurse who did my prep care to place the IV line in my antecubital vein (I did so due to reports I had read about venous irritation from the propofol - I had NO irritation with the antecubital placement_ the reports seemed to indicate an increased likely hood of irritation when the Propofol was infused into the smaller veins - so if you are asked - you may want to tell them you want your IV line in the antecube space_ as opposed to arm or hand placement) My hereditary linage is German/Irish_ former smoker (10+ years post quit) and not athletic at all(unfortunately). I was real spooked about this stuff going in_ new drug to me and all_ and if you are going to be receiving it_ it should only be administered in a facility that has the proper tools to handle any potential ACLS events - the only folks who should be giving Propofol (IMHO) are licensed and experienced anesthetists - and then_ they need to ALL the tools ready at hand to manage any problem_ should it arise. This is just common sense_ and a famous singer might be alive today had he taken this basic precaution. All the latter being said_ if I would need to be anesthetized again_ I would not hesitate to choose Propofol!,M,40,1  days,1/10/2011,Diprivan
