,Rating,Reason,Side Effects,Comments,Sex,Age,Duration/Dosage,Date Added,Drug Name
84, 3, eye surgery,"Had it three times.  Twice for the administration of local anesthestics.  It worked fine for the brief periods required--left me mildly euphoric.  Had it once for a 40-minute procedure.  It left me in a ""manic"" state--euphoric_ very irritable_ slightly irrational.  For a brief period_ I'd rate propofol a 5; for a 40-minute procedure_ I'd give it a 1.5.  The amnesia for local anethesia injections was not a problem.  However_ the 40-minute amnesia was (for reasons not quite rational) extremely upsetting_ leaving me feeling ""violated.""",,F,57,  1X D,11/28/2010,Diprivan
85, 1, outpatient surgery,"I wanted to have a simple operation fone with regional anes only (bier block).. the surgi center doesn't have anesthesiologist coverage_ so I got stuck with a nurse (crna) who ""insisted"" on sedation with propofol/fentanyl for this simple procedure.  after she gave me multiple 30mg bolus injections of propofol_ I begged he to stop. I couldn't breathe and the feeling was awful.  finally_ I got a hand free and grabbed the IV and yanked it out.   The crna got stuck_ the surgeon totally freaked out and screamed at the idiot crna.  awful drug.",if you want propofol_ get an anesthesiologist not a nurse (crna)..if you want your brain intact.,M,55,1  days200mg/day 1X D,11/28/2010,Diprivan
86, 5, IV Sedation procedure,Immediately after I was administered the Propofol_ I had a very SLIGHT burning_ then I closed my eyes_ and a second later I woke up and was ready to go home. It was like I blinked. I wasn't even groggy - just relieved that I got my work done. Being out of it for a day or two is definitely worth a life saving procedure - although with Propofol I woke up alert and probably could have driven myself home. It's the other drugs they use that can give you a hangover and linger. Not Propofol. Thank God for Propofol. I'll be having this again for an upcoming proecedure in January 2011. I'm not scared at all.,This was used for deep sedation and not General Anesthesia (GA) along with no other meds. If you had a bad experience under Anesthesia or IV sedation_ it was probably from one of the other drugs they put in your IV... NOT Propofol.,,24,2  times10mg 1X O,11/20/2010,Diprivan
87, 5, Colonoscopy,Pleasantly light-headed for about 3 hours following the procedure.  Time also seemed to speed by for several hours after O woke up--everytime I looked up at the clock another 45 minutes had sped by almost instantaneously.,"Great stuff.  This is the second colonscopy I've experienced_ the first one five years ago being overwhelmingly painful with 200 mcg fentanyl and 2 mg versed.  This time they booked me in for propofol.  The anesthetist hooked up the drug line to the IV and told me the stuff had started flowing in.  My legs sudddenly felt relaxed_ then I became a little bit dizzy_ and then I was waking up in bed in the holding cell.  Amazing.  I thought I was home in bed and was wondering if it was time to get up yet and then realized there was a door opposite me and thought_ ""wait a minute this isn't my bedroom"".  I was out of there 45 minutes later.  Stairs and walking were a slight challenge for a couple of hours because of some pleasant light-headedness and time seemed to speed by.  Stripping off the tape to remove the IV was the only painful part.  Oh_ and this morning I found out I had these things stuck to my chest where they must of had the EKG leads--they're not coming loose anytime soon.",M,61,1  times? 1X O,10/28/2010Email,Diprivan
88, 5, Colonoscopy,None.,About 10 seconds after the drug was administered_ I felt an  amazing sedative sensation. Just great_ really. The next thing I knew_ the procedure was done and I felt like I had the the most wonderful restful sleep_ ever. I remember nothing. This stuff is just the best!,M,53,1  days 1X D,10/25/2010,Diprivan
89, 1, Laser surgery,,This was a very short laser surgery_ only about 15 minutes to laser a small spot where my son has some Multiple Glomuvenous Malformations.  It didn't help them_ but caused him this debilitating pain and him not being able to walk hardly at all without even more severe pain and weakness.,M,14, ? 1X D,10/4/2010EmailHistory,Diprivan
90, 1, General anesthesia,"In post op_ I had a difficult time waking up.It took much longer for me to become coherent than it should have.  WELL_ SOMETHING IS NOT RIGHT. It is 7 days post op and I continue to feel ""out of it_"" confused_ have headaches_ difficulty concentrating at work & home_ discolored urine and more. I talked with the anesthesiologist before surgery and reminded her that I take very little medication_ rarely drink_ don't smoke and that I require less medication to achieve the proper level of anesthesia for surgery.I will never give permission for this medication to be used on me again.",,F,60,1  times 1X D,9/23/2010,Diprivan
91, 1, BRAIN injury,acute kidney failure_cardiac collaspe_multiorgan failure_ the propfol infusion syndrome came on the fourth day death came on the sixth day.This is what happens when drug companys oversell their product. This happens all to often and most hosptials dont tell the families if it happens.,http://www.ncbi.nlm.nih.gov/pubmed/18784477,M,26,5  days 6X D,9/22/2010,Diprivan
92, 1, Colonoscopy,Memory loss and anxiety. Lost sense of direction while driving_ cannot multiply in higher numbers_ am having to re-learn computer functions vs keys for my job_ and worst of all while I'm talking about something... i don't just forget the next word... but i cannot substitute another word because I Do NOT remember WHAT i was saying... Nothing seems to help. But I need more info if this has happened to others and what helped them.,,F,65,1  days300 1X D,9/16/2010,Diprivan
93, 5, colonoscopy,It entered my vein and I imediately felt calm and closed my eyes_ that was it.  I woke up and everything was over.,After researching everything on colonoscopy and the propofol they would use I was petrified...I had never been put to sleep.  I will never be afraid again_ it was a breeze and I've learned a great lesson...Don't google your procedure or meds to death...you'll always find weird and negative feedback that will scare you...there's no need for it. Trust God_ trust your Dr.,F,35,  1X D,8/9/2010,Diprivan
94, 4, EGD,Went under fairly quick_ woke up without any grogginess. Within a few hrs I felt very disoriented and sleepy which they said might happen. No burning when administered. But it's 48hrs after procedure and aim still 'out of it' and experiencing jaw pain_ no idea why,Kind of confused about the jaw pain and the length of time it's taking to leave mt system but No Anxiety!,F,38,  1X D,8/4/2010Email,Diprivan
95, 5, I give it,For those getting it as part of general anesthesia_do you know how many other drugs you are getting? the only real complaint is burning as it goes in. Other than that it does not cause sore throat unless you get a device placed for breathing_ it is supposed to render you unconscious in the case of general anesthesia_ so quit acting surprised_ and some of you are just had to please. MJ did not have a rxn to the drug. It did what it does in large doses and there was no one to support his breathing.,It does not make you stop breathing while you are awake_ muscle relaxants do that!!!and when you give consent general for anesthesia_ it is part of it_ otherwise let us know if you want us to use ether drops to make sure you stay asleep or better yet wrestle you like they did in the dark ages.,,30, 1mg/kg 1X D,7/13/2010,Diprivan
96, 2, surgery,I was given this drug for general anesthesia for a ruptured appendix. I noted no side effects until a couple of weeks later when I was helping my daughter with her math and temporarily could not do simple multiplication(ie. 8x9 which is in my long term memory)I spoke to the pharmacist at work who told me that how propafol works is that it cuts down oxygen supply to the brain.This drup has only been around for a few years.(My nurses PDR which is from 2001 does not have this drug in it). I will never take this drug again.,I am perfectly healthy_not overweight_not diabetic _no hypertension.The only medication I take is daily thyroid replacement,F,57,1  daysdon't know 1X D,6/10/2010,Diprivan
97, 1, colonoscopy,burning sensation in my throat at the time the drug was administered--when I woke up I had a severe sore throat and my voice was almost gone.  It's been 3 days since my surgery and voice is coming back slowly.,I've had propofol before and never had any problem_ but after this experience I won't take it again.,F,67,  1X D,4/30/2010,Diprivan
98, 2, anesthesia for colonoscopy,The drug really worked ..put me out instantly/no pain/  woke up feeling a little loopy.  I attributed  2 days of dizziness  and muscle spasms(post procedure)to hang- over from drug.I had muscles spasms in the neck and shoulders..(very painful.).muscles at back of neck_across the shoulders and along the jaw were very stiff. Glands under the jaw were tender to the touch. Four days after the procedure I was still having problems...Pain was so severe that I sought out assistance at an urgent care facility as my primary Doctor was not available.  The Doctor examining me  told may be it was the position I was placed in during the procedure that was causing the pain.  I asked her  if it was possible that the drug was a causitive factor..I felt fine before I went in for the colonoscopy and the only change was the fact I was given that drug....The Doctor said she couldn't correlate the symptoms I was having with the use of diprivan/propofol..I think she needs to go on the internet and educate,,F,71,  1X D,4/22/2010,Diprivan
99, 4, 5 surgeries,Minor burning upon injection (although sometimes they mixed it with something else so it wouldn't burn)_ vertigo after injection during induction (although this didn't happen when they also gave me Versed)_ minor nausea which ended up being prevented entirely in future surgeries_ and just the general tired_ groggy and dizzy feeling after surgery.,I have had 5 surgeries (3 laparoscopies_ 1 mini laparotomy (with a laparoscopy)_ breast augmentation and rhinoplasty) in the last few years and I have discovered for me the best combination is Propofol with Versed and multiple antiemetics.  If you have to have surgery/general anaesthesia_ this is by far the nicest option.,F,27,5  days 1X O,4/20/2010,Diprivan
100, 1, colonoscopy,I have been in extreme pain and on meds for 5 weeks after having propofol. The pain is mostly in my joints but my bones and almost everything hurts including the glands under my jawbone. I cam currently taking 400mg celebrex_ 7-500 Hydrocodone_ 5mg prednisone_ to stop whatever is causing the pain.,When administered_ it was one of the worst pains that I have ever felt. I screamed to the anesthesiolist that she was killing me and all she said was that the vapors had only gotten into my system the liquid hadn't entered yet. I have had a dozen surgeries and this is the first time that I have ever had pain_ especially severe pain. I do not know what to do if the pain doesn't stop soon_ I am crippled and hardly able to get out of bed? Already lost my job last Friday because I cannot function at any level. Just lying in bed hurts!,M,62,1  days? 1X D,2/23/2010Email,Diprivan
101, 5, Oral Surgery,Very SLIGHT burning sensation (I'm a small person!) which lasted a few seconds and then my eyes got a little blurry_ then I woke up feeling wonderful. The good feeling only lasted a few minutes because Propofol wears off SO fast! I am EXTREMELY sensitive to all drugs affecting brain as I am a recovering benzodiazepine dependent_ and this drug is very safe. Even with a bolus dose and Asthma_ I didn't even come close to being apneic or having low blood pressure. My anesthesiologist agrees that it is the most well tolerated anesthetic/sedative and MJ's doctor was not using it properly. The media is full of crap.,I've had this drug twice in the last 5 years. Both good experiences. Last week was for Oral Surgery_ with just Propofol and a small dose of Valium_ it was very smooth going to sleep_ no panic and waking up clearly. Very good exp. I am also a recovering benzodiazepine addict_ which made it even more important that I not have Versed (it is a benzodiazepine)_ as it (Versed) would either not work requiring huge doses or it would provoke a return of withdrawal symptoms that I experienced coming off of other benzos such as Xanax. Before I was a dependent on benzos_ Versed worked very well for me_ BUT These days_ Versed would most probably make me EXTREMELY sick due to my brain's sensitivities.,F,23,2  times30mg bolus 2X O,2/13/2010Email,Diprivan
102, 5, Surgery,Total Euphoria_ this was given to me with Ketamine.,I was completely out! I woke up and thought I was in Paradise_ I have craved the feeling since_ I had a headache later on_ but the euphoria and sedation was very good.,M,25,1  days,2/2/2010,Diprivan
103, 5, Upper Endoscopy,Burned terribly when IV was started_ but only for about 10 seconds_ then I was out.,"LOVED it.  In the past_ I've hated being knocked out- crying_ panic attack_ etc.  This was absolutely peaceful.  It was no more than 10 seconds from when they started the IV (and I felt burning) until my eyes were closing.  When it was over a simple ""It's time to wake up now"" woke me right up.  It was like waking up in the morning- within 5 minutes I was wide awake- no ""fog""_ not groggy_ not ""out of it"".  I'm a medical wimp_ and I wouldn't even sweat it if I had to have Diprivan again.",F,25,1  times,1/25/2010,Diprivan
104, 5, Anesthesiologist,Pain on injection is the most common complaint,A great medication for those who need sedation during invasive procedures.  Side effects:  If every single possible side effect was discussed prior to surgery then you would never have the surgery.  Side effects can range from nothing to death_ if not used properly.  Water can kill you if you drink too much!  I think it is reasonable to discuss common or dangerous side effects.  If you want a zero percent chance of a side effect then do not request anesthesia.  Propofol is a great drug that has the best side effect profile of any medication that is available.  Bad experiences:  This can range based on the anesthesia provider (an art and science)_ the surgical provider_ overall hospital/clinic experience and the underlying personality of the patient.  Let's be honest_ some people are impossible to safisfy.,M,40, ,11/27/2009,Diprivan
105, 1, Wisdom tooth removal,Catastrophic loss of memory_ dizziness_ inability to function at normal cognitive level,"I woke up from anaesthetic and was euphoric. My problems started as the anaesthesia wore off. I became dizzy and disorientated and unable to think logically or remember correctly. After 2 days  I rang the doctor_ and could remember my name but not my date of birth. I lost all higher cognitive function. I stopped going out. I couldnt any way as I had no mind maps I could follow. I could see my front door and ""see"" the place I wanted to go but couldnt visualise a route from memory. I could not compute; if I picked up two packs of meat in a shop I could not work out which was better value. A 2 year nightmare_ and then a 2 year recuperation.",F,35,1  days,11/22/2009,Diprivan
106, 1, surgery - cardiac ablation,It is more than two months and my memory and abilities to concentrate_ read_ think_ formulate thoughts - are crippled. Worse than a brain injury_ because I know precisely what happened. My thoughts are less cohesive and sincerely believe this is not a product that should be used. Much less administered during a 'minor' surgery. I was told by the surgeon that he had to wake me a few times - but now that I have read some of the others comments here - perhaps_ he was rousing me from the 'dead'... I have no recollection of being waken during the surgery. I will not take this again_ nor will I recommend it to anyone. It does affect the brain's abilities. BEWARE! XXXXXXX,"I had 'joked' with another doctor only earlier in the week_ ""Just don't give me what they gave Michael Jackson!"" And lo and behold_ that is exactly what they did!I had only received it one day for surgery.",F,58,1  times,10/18/2009Email,Diprivan
107, 4, Endoscopy,Woke up quickly from it_ but was sleepy rest of the day. Now it is the next day_ and I am looking up side effects_ due to headache and being lethargic and sleepy all day - Having trouble concentrating to read or work. I don't like this feeling_ particularly since they need to repeat the e-scope!,Minimal pain on injection_ out quickly.  Wake-up was like after a nap_ but a good one. But don't like the persisting grogginess.,M,60,1  times,10/16/2009,Diprivan
108, 5, Upper G.I. Endoscopy,Mild dull pain at injection site (1.5 on a 1-10 scale)_ weird taste just before falling asleep but not unpleasant. Woke up feeling absolutely fine.,I have been given IV sedation and general anesthetics using several other drugs. Propofol_ by far_ was the most tolerable. There is no period of panic. You just fall asleep and wake up feeling as if you just took a nap.,M,47,1  days,9/29/2009,Diprivan
109, 5, Colonoscopy,No pain or side effects experienced.,"My first colonoscopy had me a little concerned as I had been told by many that the sedative only provided a ""twilight"" effect.  I was quite surprised that all I remember is the IV push of two thirds of the syringe and then I was awakened in recovery.  A little intense dreaming is all recall.  Otherwise it was a very smooth procedure and quick recovery to full awareness.",M,57, ,9/24/2009,Diprivan
110, 5, colonoscopy,None whatsoever. I was asleep in three or four seconds and woke up feeling great. My last anesthetic was 43 years ago when I was five. I was terrified of being sedated again...not anymore. I highly recommend this drug for anything invasive.,PROPOFOL ROCKS...It made my first colonoscopy a breeze. I felt no pain and well rested with no disorientation upon awakening. It was like it didn't even happen. It also got rid of an intense stress headache I developed about getting a colonoscopy.,M,48,1  times,9/2/2009,Diprivan
111, 1, surgery,EXTREME pain (not just a sting) when it went in.  I screamed and fussed at them and told them they could have warned me and the pain in my arm was absolutely the worst I've EVER felt-no exaggerating.  Then while I was telking to them I stopped breathing while still awake...the nurses were telling me to 'just breathe' and I was waving my arms around and pointing at my mouth and throat to let them know I couldn't...I was WIDE AWAKE and suffocating and they weren't even looking at the monitors.,"They should warn people of things that could possibly happen as a result of this drug.  The surgical center dismissed my complaints and said they 'were sorry I had the perception' that something went wrong.  Maybe nobody told them what could happen.  When I woke up my surgeon told me_""Well_ you're alive.""",F,43,1  days,8/19/2009Email,Diprivan
112, 1, 2 surgeries,violent nausea and vomiting,I'm allergic to Versed_ so this was recommended. It burns like hell going into the IV and made me sick as a dog from my last 2 surgeries...why do they need amnesiacs anyway? You're going to remember what happened to you!!,F,50,2  days,7/31/2009,Diprivan
113, 4, Insomnia,Drowsiness; pain at injection site; death.,Diprivan helped me sleep when I needed it_ but it ruined my career as a prominent pop star when it killed me before a major tour.,M,50,5  years,7/28/2009,Diprivan
114, 5, Upper/Lower Endoscopy,Just a little bit drowsy for a few hours afterward.,I was given this along with Fentanyl before my upper and lower endoscopy yesterday. Everything went great except for a couple of times where I woke up during the procedure_ but I couldn't feel anything anyway because of the fentanyl and they put me back out as soon as I awoke. Afterward_ I felt fine except for a bit of dizziness for the next few hours_ but by that evening I was back to normal. So I can't really complain.,F,15,1  days,7/22/2009,Diprivan
115, 2, EGD (upper scope),This test had to be repeated because of a bad reaction to Versed.  The propofol wasn't any bargain either; evidently the CRNA wasn't paying attention because I stopped breathing several times and the doctor had to scream at her.,"Don't take my word for it; most find propofol to be o.k._ but for me it was not.  They had to wait for the drug to wear off to start the test; afterwards when they ermoved the mouthpiece I asked the CRNA what I was paying her to essentially do nothing and she said ""no charge"" you essentially got your test with nothing.  I was very  impressed with her professionalism and honesty_ even thought my experience was sort of a nightmare.",M,44,1  days,7/13/2009,Diprivan
116, 5, Colonoscopy,none_ it worked well without overdoing it,I was warned prior to them injecting it into my IV that I might experience a burning sensation_ but I didn't. It worked VERY quickly once introduced. Best part was_ after awakening from surgery_ I was alert and didn't have the sedated feeling at all. I felt as though I could have easily have driven home (although I didn't)not_ like previous experiences with other anesthetics_ where I was groggy for several hours after surgery.,M,50,1  times,7/11/2009,Diprivan
117, 5, Colonoscopy,None.,"It worked as I had been told it would_ except I had no burning sensation at all when they injected it.I was about to tell the nurse ""Don't start yet_ I'm not totally sedated"" when she said: ""Good_ you are awake_ it's all done"". A ew minutes later I discussed the results with the doctor_ and in 15 minutes I was on my way home.I will definitely ask for this drug again for my next procedure.",M,53, ,7/10/2009,Diprivan
118, 5, cortisone shots for herniated disk,none- worked great - just went to sleep and awoke instantly. It felt like the most natural sleep. I felt completely refreshed. I wish I could sleep like that all the time.,I had the procedure twice and had the some result both times. When I told the anesthetist how great the sleep was_ he said it has changed the way they administer anesthesia - really revolutionized it - controls how quickly you go under and come out of anesthesia.,F,58,1  days,7/2/2009,Diprivan
119, 1, Reconstructive Surgery,NONE! I was given versed first and it did not put me under no matter how much they gave me. They then went to the arsenal and told me they were going to give me propofol (diprivan) and they did and gave more and more and more and more. Eventually they gave up told me NOTHING would put me under and then proceeded to do the surgery with only local anasthesia which was horrible since it was facial surgery and I literally had to sit still as they peeled my face off and around and put me back together! I am glad I have a very high pain tolerance.,The doctors told me I was the first person they have seen to NOT go under from any amount of this medication. I was told I likely had a very high metabolism which is true and also why I do not do drugs or tend to get a buzz off anything. I just think that better drugs or methods need to be developed because when this does work it seems scary from what I have read and for me this was shocking to not go under from a general!,F,35, ,7/2/2009,Diprivan
120, 3, Colonoscopy,Slept a lot the day I had it and the next day I was lethargic and sleepy all day - couldn't even read a book. I felt sad all day_ with a complete lack of energy.  I didn't like this feeling and may not take this drug again.,Otherwise the drug worked just as they told me it would - I didn't feel it going in the IV (they said it would burn_ but it didn't)_ and moments after the anaesthesiologist said it was on its way_ I fuzzed out of consciousness. The next thing I knew the nurse was leading me back to the recovery room (I was out for about 15 minutes) and about 10 minutes later I was on my way home.,F,43,1  times,5/9/2009,Diprivan
121, 5, ,,,,, ,5/6/2009,Diprivan
122, 5, ENDOSCOPY,TEARFUL AND FOGGY FOR ABOUT 30 MIN AFTER,,M,46,1  days,4/25/2009,Diprivan
123, 5, gastroscopy,So far no side effects.  I only had it this morning and it went very well. No pain at injection site as I was told there might be when Diprivan is administered.  I was under for the whole procedure and woke up about 30 mins later. I'm feeling a bit dizzy and can't fully concentrate yet but I've spent a couple of hours working on the computer this afternoon and helping my kids with their homework - so it's not too bad! I got myself home from the hospital alone on public transport after the procedure and I seemed to have asked the doctor all the relevant intelligent questions I thought I needed to ask after the procedure. I even rang up my health insurance company to ask them some questions. I think I was intelligible!  So_ so far so good and I'll probably be getting another one in a week or 2 as a follow up procedure.  I'll let you know if I have any on-going problems.,Was great_ even though I knew it was unnecessary_ but this is the only option the hospital offers.  I probably would have taken the option of sedation rather than a general anaesthetic if it was offered though_ as I prefer less chemical intervention.,F,38,1  days,2/2/2009,Diprivan
